prodID,name,price,subCatID
EU-FUR-BO-10000002,"Bush Classic Bookcase, Mobile",415.20,FUR-101
EU-FUR-BO-10000022,"Dania Floating Shelf Set, Traditional",169.35,FUR-101
EU-FUR-BO-10000034,"Safco Classic Bookcase, Pine",439.50,FUR-101
EU-FUR-BO-10000120,"Sauder Stackable Bookrack, Mobile",146.82,FUR-101
EU-FUR-BO-10000155,"Dania Corner Shelving, Metal",121.53,FUR-101
EU-FUR-BO-10000160,"Safco Library with Doors, Pine",391.14,FUR-101
EU-FUR-BO-10000170,"Safco Library with Doors, Mobile",392.31,FUR-101
EU-FUR-BO-10000259,"Safco Classic Bookcase, Traditional",438.15,FUR-101
EU-FUR-BO-10000265,"Bush Floating Shelf Set, Pine",172.62,FUR-101
EU-FUR-BO-10000268,"Bush Library with Doors, Pine",365.67,FUR-101
EU-FUR-BO-10000279,"Dania Classic Bookcase, Pine",412.11,FUR-101
EU-FUR-BO-10000311,"Safco Floating Shelf Set, Metal",196.20,FUR-101
EU-FUR-BO-10000490,"Bush Library with Doors, Metal",363.78,FUR-101
EU-FUR-BO-10000514,"Bush Library with Doors, Traditional",364.32,FUR-101
EU-FUR-BO-10000533,"Dania Corner Shelving, Pine",123.42,FUR-101
EU-FUR-BO-10000596,"Sauder Classic Bookcase, Mobile",438.51,FUR-101
EU-FUR-BO-10000684,"Sauder Corner Shelving, Traditional",147.30,FUR-101
EU-FUR-BO-10000728,"Dania Corner Shelving, Traditional",122.07,FUR-101
EU-FUR-BO-10000786,"Sauder Stackable Bookrack, Pine",148.17,FUR-101
EU-FUR-BO-10000797,"Safco 3-Shelf Cabinet, Pine",170.19,FUR-101
EU-FUR-BO-10000820,"Sauder 3-Shelf Cabinet, Metal",166.14,FUR-101
EU-FUR-BO-10000847,"Dania Stackable Bookrack, Mobile",121.59,FUR-101
EU-FUR-BO-10000895,"Sauder Corner Shelving, Metal",146.76,FUR-101
EU-FUR-BO-10000936,"Bush Floating Shelf Set, Traditional",171.27,FUR-101
EU-FUR-BO-10000967,"Ikea Library with Doors, Pine",364.74,FUR-101
EU-FUR-BO-10001003,"Dania 3-Shelf Cabinet, Traditional",141.45,FUR-101
EU-FUR-BO-10001010,"Dania Corner Shelving, Mobile",124.59,FUR-101
EU-FUR-BO-10001039,"Dania Classic Bookcase, Traditional",410.76,FUR-101
EU-FUR-BO-10001133,"Ikea Classic Bookcase, Mobile",414.27,FUR-101
EU-FUR-BO-10001155,"Ikea 3-Shelf Cabinet, Metal",141.90,FUR-101
EU-FUR-BO-10001165,"Bush Library with Doors, Mobile",366.84,FUR-101
EU-FUR-BO-10001256,"Ikea Corner Shelving, Pine",124.41,FUR-101
EU-FUR-BO-10001287,"Dania Floating Shelf Set, Metal",168.81,FUR-101
EU-FUR-BO-10001324,"Sauder Floating Shelf Set, Pine",195.93,FUR-101
EU-FUR-BO-10001387,"Safco Floating Shelf Set, Traditional",196.74,FUR-101
EU-FUR-BO-10001392,"Sauder Classic Bookcase, Traditional",435.99,FUR-101
EU-FUR-BO-10001405,"Bush Stackable Bookrack, Pine",124.86,FUR-101
EU-FUR-BO-10001436,"Bush Corner Shelving, Traditional",123.99,FUR-101
EU-FUR-BO-10001537,"Ikea Corner Shelving, Metal",122.52,FUR-101
EU-FUR-BO-10001553,"Sauder Library with Doors, Traditional",387.63,FUR-101
EU-FUR-BO-10001555,"Bush Corner Shelving, Metal",123.45,FUR-101
EU-FUR-BO-10001621,"Dania Stackable Bookrack, Traditional",121.05,FUR-101
EU-FUR-BO-10001714,"Dania Floating Shelf Set, Mobile",171.87,FUR-101
EU-FUR-BO-10001831,"Sauder Floating Shelf Set, Metal",194.04,FUR-101
EU-FUR-BO-10001834,"Ikea 3-Shelf Cabinet, Mobile",144.96,FUR-101
EU-FUR-BO-10001873,"Ikea Floating Shelf Set, Mobile",172.86,FUR-101
EU-FUR-BO-10001876,"Safco Corner Shelving, Pine",150.81,FUR-101
EU-FUR-BO-10001888,"Dania Floating Shelf Set, Pine",170.70,FUR-101
EU-FUR-BO-10001892,"Sauder Library with Doors, Pine",388.98,FUR-101
EU-FUR-BO-10001943,"Safco Library with Doors, Traditional",389.79,FUR-101
EU-FUR-BO-10002003,"Sauder Classic Bookcase, Metal",435.45,FUR-101
EU-FUR-BO-10002133,"Bush Corner Shelving, Mobile",126.51,FUR-101
EU-FUR-BO-10002182,"Safco Floating Shelf Set, Pine",198.09,FUR-101
EU-FUR-BO-10002318,"Dania Classic Bookcase, Mobile",413.28,FUR-101
EU-FUR-BO-10002529,"Safco Library with Doors, Metal",389.25,FUR-101
EU-FUR-BO-10002632,"Sauder Corner Shelving, Pine",148.65,FUR-101
EU-FUR-BO-10002680,"Sauder 3-Shelf Cabinet, Traditional",166.68,FUR-101
EU-FUR-BO-10002708,"Dania Library with Doors, Pine",363.75,FUR-101
EU-FUR-BO-10002781,"Sauder Floating Shelf Set, Traditional",194.58,FUR-101
EU-FUR-BO-10002812,"Sauder 3-Shelf Cabinet, Pine",168.03,FUR-101
EU-FUR-BO-10002889,"Dania Stackable Bookrack, Pine",124.11,FUR-101
EU-FUR-BO-10002892,"Safco Classic Bookcase, Mobile",440.67,FUR-101
EU-FUR-BO-10002926,"Bush Stackable Bookrack, Mobile",123.51,FUR-101
EU-FUR-BO-10002936,"Ikea Stackable Bookrack, Pine",123.93,FUR-101
EU-FUR-BO-10003007,"Ikea Stackable Bookrack, Metal",122.04,FUR-101
EU-FUR-BO-10003028,"Sauder 3-Shelf Cabinet, Mobile",169.20,FUR-101
EU-FUR-BO-10003103,"Ikea Classic Bookcase, Metal",411.21,FUR-101
EU-FUR-BO-10003126,"Dania Library with Doors, Traditional",362.40,FUR-101
EU-FUR-BO-10003333,"Sauder Stackable Bookrack, Traditional",146.28,FUR-101
EU-FUR-BO-10003541,"Bush Classic Bookcase, Metal",412.14,FUR-101
EU-FUR-BO-10003554,"Dania 3-Shelf Cabinet, Mobile",143.97,FUR-101
EU-FUR-BO-10003559,"Sauder Stackable Bookrack, Pine",149.34,FUR-101
EU-FUR-BO-10003604,"Ikea Corner Shelving, Mobile",125.58,FUR-101
EU-FUR-BO-10003647,"Ikea Classic Bookcase, Pine",413.10,FUR-101
EU-FUR-BO-10003697,"Safco Floating Shelf Set, Mobile",199.26,FUR-101
EU-FUR-BO-10003734,"Dania Classic Bookcase, Metal",410.22,FUR-101
EU-FUR-BO-10003738,"Dania Library with Doors, Mobile",364.92,FUR-101
EU-FUR-BO-10003779,"Ikea Library with Doors, Traditional",363.39,FUR-101
EU-FUR-BO-10003828,"Bush 3-Shelf Cabinet, Metal",142.83,FUR-101
EU-FUR-BO-10003878,"Safco Corner Shelving, Mobile",151.98,FUR-101
EU-FUR-BO-10003881,"Sauder Floating Shelf Set, Mobile",197.10,FUR-101
EU-FUR-BO-10003903,"Dania 3-Shelf Cabinet, Pine",142.80,FUR-101
EU-FUR-BO-10003904,"Ikea Corner Shelving, Traditional",123.06,FUR-101
EU-FUR-BO-10003905,"Ikea Stackable Bookrack, Mobile",125.10,FUR-101
EU-FUR-BO-10003968,"Sauder Library with Doors, Mobile",390.15,FUR-101
EU-FUR-BO-10003991,"Bush Classic Bookcase, Traditional",412.68,FUR-101
EU-FUR-BO-10004053,"Dania Library with Doors, Metal",361.86,FUR-101
EU-FUR-BO-10004055,"Safco Corner Shelving, Metal",148.92,FUR-101
EU-FUR-BO-10004080,"Ikea Stackable Bookrack, Traditional",122.58,FUR-101
EU-FUR-BO-10004119,"Ikea Floating Shelf Set, Traditional",170.34,FUR-101
EU-FUR-BO-10004129,"Sauder Classic Bookcase, Pine",437.34,FUR-101
EU-FUR-BO-10004191,"Safco Corner Shelving, Traditional",149.46,FUR-101
EU-FUR-BO-10004199,"Ikea 3-Shelf Cabinet, Pine",143.79,FUR-101
EU-FUR-BO-10004219,"Safco 3-Shelf Cabinet, Metal",168.30,FUR-101
EU-FUR-BO-10004254,"Ikea Classic Bookcase, Traditional",411.75,FUR-101
EU-FUR-BO-10004316,"Bush 3-Shelf Cabinet, Pine",144.72,FUR-101
EU-FUR-BO-10004327,"Bush 3-Shelf Cabinet, Mobile",145.89,FUR-101
EU-FUR-BO-10004388,"Ikea Library with Doors, Metal",362.85,FUR-101
EU-FUR-BO-10004408,"Dania Stackable Bookrack, Pine",122.94,FUR-101
EU-FUR-BO-10004430,"Bush Floating Shelf Set, Metal",170.73,FUR-101
EU-FUR-BO-10004445,"Bush Stackable Bookrack, Pine",126.03,FUR-101
EU-FUR-BO-10004483,"Ikea Floating Shelf Set, Pine",171.69,FUR-101
EU-FUR-BO-10004547,"Bush Stackable Bookrack, Traditional",122.97,FUR-101
EU-FUR-BO-10004560,"Bush Floating Shelf Set, Mobile",173.79,FUR-101
EU-FUR-BO-10004585,"Ikea 3-Shelf Cabinet, Traditional",142.44,FUR-101
EU-FUR-BO-10004620,"Safco Stackable Bookrack, Mobile",148.98,FUR-101
EU-FUR-BO-10004630,"Ikea Library with Doors, Mobile",365.91,FUR-101
EU-FUR-BO-10004660,"Sauder Library with Doors, Metal",387.09,FUR-101
EU-FUR-BO-10004704,"Bush Corner Shelving, Pine",125.34,FUR-101
EU-FUR-BO-10004709,"Bush Classic Bookcase, Pine",414.03,FUR-101
EU-FUR-BO-10004824,"Safco Stackable Bookrack, Traditional",148.44,FUR-101
EU-FUR-BO-10004834,"Safco 3-Shelf Cabinet, Mobile",171.36,FUR-101
EU-FUR-BO-10004844,"Sauder Corner Shelving, Mobile",149.82,FUR-101
EU-FUR-BO-10004914,"Bush 3-Shelf Cabinet, Traditional",143.37,FUR-101
EU-FUR-BO-10004926,"Safco 3-Shelf Cabinet, Traditional",168.84,FUR-101
EU-FUR-BO-10004947,"Safco Stackable Bookrack, Pine",150.33,FUR-101
EU-FUR-BO-10004999,"Safco Classic Bookcase, Metal",437.61,FUR-101
EU-FUR-CH-10000013,"Hon Steel Folding Chair, Black",78.99,FUR-102
EU-FUR-CH-10000068,"Office Star Steel Folding Chair, Red",91.71,FUR-102
EU-FUR-CH-10000105,"Hon Steel Folding Chair, Set of Two",83.67,FUR-102
EU-FUR-CH-10000133,"Harbour Creations Steel Folding Chair, Black",95.46,FUR-102
EU-FUR-CH-10000213,"Hon Swivel Stool, Red",163.65,FUR-102
EU-FUR-CH-10000214,"Harbour Creations Bag Chairs, Black",59.19,FUR-102
EU-FUR-CH-10000333,"SAFCO Swivel Stool, Black",165.51,FUR-102
EU-FUR-CH-10000399,"Hon Swivel Stool, Set of Two",165.90,FUR-102
EU-FUR-CH-10000423,"Hon Chairmat, Set of Two",57.78,FUR-102
EU-FUR-CH-10000479,"Harbour Creations Executive Leather Armchair, Adjustable",471.18,FUR-102
EU-FUR-CH-10000488,"SAFCO Steel Folding Chair, Black",83.28,FUR-102
EU-FUR-CH-10000546,"Harbour Creations Executive Leather Armchair, Adjustable",476.10,FUR-102
EU-FUR-CH-10000568,"Hon Bag Chairs, Black",42.72,FUR-102
EU-FUR-CH-10000583,"Novimex Swivel Stool, Set of Two",166.71,FUR-102
EU-FUR-CH-10000603,"Hon Bag Chairs, Red",45.15,FUR-102
EU-FUR-CH-10000663,"Hon Steel Folding Chair, Adjustable",83.91,FUR-102
EU-FUR-CH-10000667,"Novimex Chairmat, Black",53.91,FUR-102
EU-FUR-CH-10000685,"Hon Executive Leather Armchair, Black",457.14,FUR-102
EU-FUR-CH-10000690,"Novimex Bag Chairs, Black",43.53,FUR-102
EU-FUR-CH-10000727,"Office Star Chairmat, Set of Two",68.07,FUR-102
EU-FUR-CH-10000745,"Hon Chairmat, Adjustable",58.02,FUR-102
EU-FUR-CH-10000774,"SAFCO Rocking Chair, Set of Two",137.16,FUR-102
EU-FUR-CH-10000807,"Hon Rocking Chair, Adjustable",133.11,FUR-102
EU-FUR-CH-10000848,"SAFCO Executive Leather Armchair, Set of Two",463.68,FUR-102
EU-FUR-CH-10000857,"Harbour Creations Rocking Chair, Black",144.66,FUR-102
EU-FUR-CH-10000966,"Harbour Creations Chairmat, Set of Two",74.25,FUR-102
EU-FUR-CH-10000969,"Hon Executive Leather Armchair, Red",459.39,FUR-102
EU-FUR-CH-10001037,"SAFCO Chairmat, Adjustable",62.31,FUR-102
EU-FUR-CH-10001039,"Harbour Creations Rocking Chair, Adjustable",149.58,FUR-102
EU-FUR-CH-10001043,"Harbour Creations Bag Chairs, Red",61.62,FUR-102
EU-FUR-CH-10001051,"Hon Chairmat, Red",55.53,FUR-102
EU-FUR-CH-10001150,"SAFCO Steel Folding Chair, Red",85.71,FUR-102
EU-FUR-CH-10001153,"Harbour Creations Bag Chairs, Adjustable",64.11,FUR-102
EU-FUR-CH-10001237,"Hon Swivel Stool, Black",161.22,FUR-102
EU-FUR-CH-10001278,"SAFCO Chairmat, Black",57.39,FUR-102
EU-FUR-CH-10001429,"SAFCO Executive Leather Armchair, Adjustable",463.92,FUR-102
EU-FUR-CH-10001553,"Hon Bag Chairs, Adjustable",47.64,FUR-102
EU-FUR-CH-10001582,"Office Star Executive Leather Armchair, Black",467.43,FUR-102
EU-FUR-CH-10001663,"SAFCO Chairmat, Set of Two",62.07,FUR-102
EU-FUR-CH-10001674,"Office Star Chairmat, Adjustable",68.31,FUR-102
EU-FUR-CH-10001726,"Office Star Steel Folding Chair, Adjustable",94.20,FUR-102
EU-FUR-CH-10001784,"SAFCO Bag Chairs, Adjustable",51.93,FUR-102
EU-FUR-CH-10001802,"Novimex Rocking Chair, Black",129.00,FUR-102
EU-FUR-CH-10001831,"Novimex Rocking Chair, Set of Two",133.68,FUR-102
EU-FUR-CH-10002002,"Hon Rocking Chair, Black",128.19,FUR-102
EU-FUR-CH-10002030,"Office Star Swivel Stool, Red",173.94,FUR-102
EU-FUR-CH-10002053,"Novimex Chairmat, Set of Two",58.59,FUR-102
EU-FUR-CH-10002085,"Novimex Steel Folding Chair, Red",82.23,FUR-102
EU-FUR-CH-10002090,"Hon Swivel Stool, Adjustable",166.14,FUR-102
EU-FUR-CH-10002116,"SAFCO Rocking Chair, Black",132.48,FUR-102
EU-FUR-CH-10002152,"Hon Bag Chairs, Set of Two",47.40,FUR-102
EU-FUR-CH-10002203,"SAFCO Executive Leather Armchair, Black",459.00,FUR-102
EU-FUR-CH-10002212,"Novimex Swivel Stool, Adjustable",166.95,FUR-102
EU-FUR-CH-10002275,"Novimex Executive Leather Armchair, Adjustable",460.44,FUR-102
EU-FUR-CH-10002288,"SAFCO Bag Chairs, Red",49.44,FUR-102
EU-FUR-CH-10002335,"Hon Steel Folding Chair, Red",81.42,FUR-102
EU-FUR-CH-10002373,"Office Star Rocking Chair, Set of Two",143.16,FUR-102
EU-FUR-CH-10002378,"Harbour Creations Swivel Stool, Black",177.69,FUR-102
EU-FUR-CH-10002477,"Harbour Creations Executive Leather Armchair, Red",475.86,FUR-102
EU-FUR-CH-10002498,"Harbour Creations Steel Folding Chair, Red",97.89,FUR-102
EU-FUR-CH-10002543,"SAFCO Steel Folding Chair, Set of Two",87.96,FUR-102
EU-FUR-CH-10002574,"Office Star Chairmat, Black",63.39,FUR-102
EU-FUR-CH-10002585,"Harbour Creations Executive Leather Armchair, Black",473.61,FUR-102
EU-FUR-CH-10002610,"Novimex Swivel Stool, Black",162.03,FUR-102
EU-FUR-CH-10002647,"Novimex Rocking Chair, Red",131.43,FUR-102
EU-FUR-CH-10002752,"Harbour Creations Bag Chairs, Set of Two",63.87,FUR-102
EU-FUR-CH-10002782,"Office Star Executive Leather Armchair, Adjustable",469.92,FUR-102
EU-FUR-CH-10002816,"Harbour Creations Swivel Stool, Adjustable",182.61,FUR-102
EU-FUR-CH-10002819,"SAFCO Chairmat, Red",59.82,FUR-102
EU-FUR-CH-10002830,"Office Star Rocking Chair, Red",140.91,FUR-102
EU-FUR-CH-10002891,"Hon Executive Leather Armchair, Adjustable",454.71,FUR-102
EU-FUR-CH-10002927,"Office Star Swivel Stool, Black",171.51,FUR-102
EU-FUR-CH-10002970,"Harbour Creations Chairmat, Black",69.57,FUR-102
EU-FUR-CH-10002974,"SAFCO Rocking Chair, Red",134.91,FUR-102
EU-FUR-CH-10002991,"Novimex Steel Folding Chair, Adjustable",84.72,FUR-102
EU-FUR-CH-10003026,"Novimex Bag Chairs, Adjustable",48.45,FUR-102
EU-FUR-CH-10003033,"Novimex Rocking Chair, Adjustable",133.92,FUR-102
EU-FUR-CH-10003054,"Novimex Executive Leather Armchair, Adjustable",455.52,FUR-102
EU-FUR-CH-10003062,"Novimex Chairmat, Red",56.34,FUR-102
EU-FUR-CH-10003114,"Harbour Creations Swivel Stool, Red",180.12,FUR-102
EU-FUR-CH-10003168,"Office Star Swivel Stool, Set of Two",176.19,FUR-102
EU-FUR-CH-10003248,"SAFCO Bag Chairs, Black",47.01,FUR-102
EU-FUR-CH-10003249,"Office Star Steel Folding Chair, Black",89.28,FUR-102
EU-FUR-CH-10003355,"Harbour Creations Chairmat, Adjustable",74.49,FUR-102
EU-FUR-CH-10003362,"Office Star Swivel Stool, Adjustable",176.43,FUR-102
EU-FUR-CH-10003365,"Office Star Executive Leather Armchair, Adjustable",465.00,FUR-102
EU-FUR-CH-10003440,"Harbour Creations Steel Folding Chair, Set of Two",100.14,FUR-102
EU-FUR-CH-10003499,"SAFCO Swivel Stool, Red",167.94,FUR-102
EU-FUR-CH-10003540,"Office Star Bag Chairs, Set of Two",57.69,FUR-102
EU-FUR-CH-10003746,"Novimex Executive Leather Armchair, Black",457.95,FUR-102
EU-FUR-CH-10003750,"Harbour Creations Rocking Chair, Red",147.09,FUR-102
EU-FUR-CH-10003772,"Office Star Chairmat, Red",65.82,FUR-102
EU-FUR-CH-10003794,"SAFCO Bag Chairs, Set of Two",51.69,FUR-102
EU-FUR-CH-10003808,"Harbour Creations Steel Folding Chair, Adjustable",100.38,FUR-102
EU-FUR-CH-10003842,"Harbour Creations Chairmat, Red",72.00,FUR-102
EU-FUR-CH-10003848,"Office Star Rocking Chair, Adjustable",143.40,FUR-102
EU-FUR-CH-10004040,"Office Star Steel Folding Chair, Set of Two",93.96,FUR-102
EU-FUR-CH-10004047,"SAFCO Rocking Chair, Adjustable",137.40,FUR-102
EU-FUR-CH-10004095,"Novimex Steel Folding Chair, Black",79.80,FUR-102
EU-FUR-CH-10004101,"SAFCO Swivel Stool, Adjustable",170.43,FUR-102
EU-FUR-CH-10004194,"Novimex Bag Chairs, Red",45.96,FUR-102
EU-FUR-CH-10004255,"SAFCO Executive Leather Armchair, Red",461.43,FUR-102
EU-FUR-CH-10004309,"SAFCO Steel Folding Chair, Adjustable",88.20,FUR-102
EU-FUR-CH-10004355,"Harbour Creations Rocking Chair, Set of Two",149.34,FUR-102
EU-FUR-CH-10004462,"Hon Executive Leather Armchair, Adjustable",459.63,FUR-102
EU-FUR-CH-10004506,"Novimex Steel Folding Chair, Set of Two",84.48,FUR-102
EU-FUR-CH-10004536,"Novimex Bag Chairs, Set of Two",48.21,FUR-102
EU-FUR-CH-10004592,"Hon Rocking Chair, Set of Two",132.87,FUR-102
EU-FUR-CH-10004606,"Hon Rocking Chair, Red",130.62,FUR-102
EU-FUR-CH-10004676,"Office Star Rocking Chair, Black",138.48,FUR-102
EU-FUR-CH-10004685,"Harbour Creations Swivel Stool, Set of Two",182.37,FUR-102
EU-FUR-CH-10004774,"Novimex Executive Leather Armchair, Red",460.20,FUR-102
EU-FUR-CH-10004790,"Office Star Bag Chairs, Black",53.01,FUR-102
EU-FUR-CH-10004792,"SAFCO Swivel Stool, Set of Two",170.19,FUR-102
EU-FUR-CH-10004910,"Office Star Executive Leather Armchair, Red",469.68,FUR-102
EU-FUR-CH-10004943,"Office Star Bag Chairs, Adjustable",57.93,FUR-102
EU-FUR-CH-10004969,"Office Star Bag Chairs, Red",55.44,FUR-102
EU-FUR-FU-10000039,"Tenex Light Bulb, Duo Pack",18.99,FUR-104
EU-FUR-FU-10000072,"Advantus Light Bulb, Erganomic",18.69,FUR-104
EU-FUR-FU-10000135,"Tenex Photo Frame, Black",51.84,FUR-104
EU-FUR-FU-10000142,"Tenex Stacking Tray, Erganomic",22.26,FUR-104
EU-FUR-FU-10000163,"Deflect-O Frame, Duo Pack",110.10,FUR-104
EU-FUR-FU-10000188,"Tenex Frame, Duo Pack",110.04,FUR-104
EU-FUR-FU-10000204,"Advantus Door Stop, Durable",42.06,FUR-104
EU-FUR-FU-10000225,"Rubbermaid Photo Frame, Durable",48.78,FUR-104
EU-FUR-FU-10000267,"Advantus Clock, Durable",48.42,FUR-104
EU-FUR-FU-10000287,"Eldon Stacking Tray, Black",31.50,FUR-104
EU-FUR-FU-10000295,"Advantus Light Bulb, Durable",17.10,FUR-104
EU-FUR-FU-10000298,"Eldon Photo Frame, Duo Pack",58.17,FUR-104
EU-FUR-FU-10000361,"Eldon Stacking Tray, Duo Pack",31.56,FUR-104
EU-FUR-FU-10000368,"Deflect-O Frame, Durable",107.07,FUR-104
EU-FUR-FU-10000388,"Rubbermaid Door Stop, Erganomic",42.42,FUR-104
EU-FUR-FU-10000432,"Eldon Clock, Black",56.52,FUR-104
EU-FUR-FU-10000444,"Advantus Stacking Tray, Erganomic",24.99,FUR-104
EU-FUR-FU-10000468,"Advantus Frame, Durable",108.15,FUR-104
EU-FUR-FU-10000502,"Deflect-O Clock, Black",50.31,FUR-104
EU-FUR-FU-10000567,"Rubbermaid Light Bulb, Erganomic",17.46,FUR-104
EU-FUR-FU-10000605,"Rubbermaid Light Bulb, Black",18.84,FUR-104
EU-FUR-FU-10000612,"Tenex Frame, Black",109.98,FUR-104
EU-FUR-FU-10000620,"Advantus Clock, Black",51.39,FUR-104
EU-FUR-FU-10000668,"Tenex Frame, Durable",107.01,FUR-104
EU-FUR-FU-10000718,"Tenex Stacking Tray, Erganomic",23.85,FUR-104
EU-FUR-FU-10000905,"Eldon Door Stop, Erganomic",48.78,FUR-104
EU-FUR-FU-10000907,"Eldon Clock, Duo Pack",56.58,FUR-104
EU-FUR-FU-10000913,"Rubbermaid Door Stop, Durable",40.83,FUR-104
EU-FUR-FU-10000946,"Advantus Stacking Tray, Durable",26.37,FUR-104
EU-FUR-FU-10000950,"Deflect-O Door Stop, Durable",40.98,FUR-104
EU-FUR-FU-10000972,"Rubbermaid Clock, Erganomic",48.78,FUR-104
EU-FUR-FU-10001063,"Eldon Light Bulb, Black",25.20,FUR-104
EU-FUR-FU-10001086,"Advantus Frame, Black",111.12,FUR-104
EU-FUR-FU-10001090,"Advantus Stacking Tray, Erganomic",23.40,FUR-104
EU-FUR-FU-10001132,"Deflect-O Frame, Erganomic",108.66,FUR-104
EU-FUR-FU-10001169,"Rubbermaid Clock, Duo Pack",50.22,FUR-104
EU-FUR-FU-10001194,"Rubbermaid Light Bulb, Duo Pack",18.90,FUR-104
EU-FUR-FU-10001200,"Tenex Photo Frame, Erganomic",50.46,FUR-104
EU-FUR-FU-10001252,"Eldon Frame, Duo Pack",116.31,FUR-104
EU-FUR-FU-10001366,"Advantus Photo Frame, Duo Pack",53.04,FUR-104
EU-FUR-FU-10001424,"Eldon Photo Frame, Durable",55.14,FUR-104
EU-FUR-FU-10001436,"Advantus Clock, Duo Pack",51.45,FUR-104
EU-FUR-FU-10001438,"Rubbermaid Frame, Duo Pack",109.95,FUR-104
EU-FUR-FU-10001495,"Eldon Door Stop, Durable",47.19,FUR-104
EU-FUR-FU-10001691,"Deflect-O Photo Frame, Black",51.90,FUR-104
EU-FUR-FU-10001692,"Deflect-O Clock, Durable",47.34,FUR-104
EU-FUR-FU-10001717,"Rubbermaid Stacking Tray, Erganomic",23.76,FUR-104
EU-FUR-FU-10001718,"Eldon Door Stop, Duo Pack",50.22,FUR-104
EU-FUR-FU-10001760,"Tenex Light Bulb, Black",18.93,FUR-104
EU-FUR-FU-10001775,"Deflect-O Stacking Tray, Durable",25.29,FUR-104
EU-FUR-FU-10001890,"Eldon Clock, Durable",53.55,FUR-104
EU-FUR-FU-10001915,"Rubbermaid Stacking Tray, Black",25.20,FUR-104
EU-FUR-FU-10001950,"Eldon Door Stop, Black",50.16,FUR-104
EU-FUR-FU-10002017,"Rubbermaid Door Stop, Duo Pack",43.86,FUR-104
EU-FUR-FU-10002019,"Eldon Photo Frame, Black",58.11,FUR-104
EU-FUR-FU-10002094,"Rubbermaid Photo Frame, Erganomic",50.37,FUR-104
EU-FUR-FU-10002170,"Eldon Stacking Tray, Durable",28.53,FUR-104
EU-FUR-FU-10002304,"Tenex Photo Frame, Duo Pack",51.90,FUR-104
EU-FUR-FU-10002305,"Advantus Door Stop, Black",45.03,FUR-104
EU-FUR-FU-10002502,"Eldon Light Bulb, Durable",22.23,FUR-104
EU-FUR-FU-10002521,"Tenex Stacking Tray, Black",25.29,FUR-104
EU-FUR-FU-10002539,"Tenex Clock, Erganomic",48.87,FUR-104
EU-FUR-FU-10002549,"Deflect-O Clock, Duo Pack",50.37,FUR-104
EU-FUR-FU-10002557,"Rubbermaid Stacking Tray, Erganomic",22.17,FUR-104
EU-FUR-FU-10002614,"Tenex Door Stop, Black",43.89,FUR-104
EU-FUR-FU-10002655,"Deflect-O Door Stop, Black",43.95,FUR-104
EU-FUR-FU-10002709,"Advantus Clock, Erganomic",50.01,FUR-104
EU-FUR-FU-10002919,"Rubbermaid Frame, Erganomic",108.51,FUR-104
EU-FUR-FU-10002937,"Rubbermaid Light Bulb, Durable",15.87,FUR-104
EU-FUR-FU-10002957,"Tenex Stacking Tray, Durable",25.23,FUR-104
EU-FUR-FU-10002979,"Eldon Frame, Black",116.25,FUR-104
EU-FUR-FU-10003046,"Advantus Photo Frame, Durable",50.01,FUR-104
EU-FUR-FU-10003069,"Deflect-O Photo Frame, Durable",48.93,FUR-104
EU-FUR-FU-10003219,"Eldon Frame, Erganomic",114.87,FUR-104
EU-FUR-FU-10003264,"Rubbermaid Clock, Black",50.16,FUR-104
EU-FUR-FU-10003325,"Tenex Door Stop, Duo Pack",43.95,FUR-104
EU-FUR-FU-10003462,"Rubbermaid Photo Frame, Black",51.75,FUR-104
EU-FUR-FU-10003500,"Rubbermaid Photo Frame, Duo Pack",51.81,FUR-104
EU-FUR-FU-10003512,"Eldon Stacking Tray, Erganomic",30.12,FUR-104
EU-FUR-FU-10003540,"Deflect-O Stacking Tray, Erganomic",23.91,FUR-104
EU-FUR-FU-10003619,"Tenex Clock, Black",50.25,FUR-104
EU-FUR-FU-10003651,"Deflect-O Stacking Tray, Erganomic",22.32,FUR-104
EU-FUR-FU-10003662,"Tenex Door Stop, Erganomic",42.51,FUR-104
EU-FUR-FU-10003664,"Tenex Frame, Erganomic",108.60,FUR-104
EU-FUR-FU-10003804,"Rubbermaid Frame, Durable",106.92,FUR-104
EU-FUR-FU-10003862,"Advantus Photo Frame, Black",52.98,FUR-104
EU-FUR-FU-10003879,"Advantus Frame, Erganomic",109.74,FUR-104
EU-FUR-FU-10003910,"Rubbermaid Stacking Tray, Durable",25.14,FUR-104
EU-FUR-FU-10003970,"Rubbermaid Clock, Durable",47.19,FUR-104
EU-FUR-FU-10003986,"Rubbermaid Door Stop, Black",43.80,FUR-104
EU-FUR-FU-10004049,"Eldon Light Bulb, Erganomic",23.82,FUR-104
EU-FUR-FU-10004095,"Eldon Frame, Durable",113.28,FUR-104
EU-FUR-FU-10004096,"Deflect-O Light Bulb, Erganomic",17.61,FUR-104
EU-FUR-FU-10004097,"Advantus Door Stop, Duo Pack",45.09,FUR-104
EU-FUR-FU-10004137,"Tenex Light Bulb, Erganomic",17.55,FUR-104
EU-FUR-FU-10004152,"Eldon Photo Frame, Erganomic",56.73,FUR-104
EU-FUR-FU-10004236,"Deflect-O Light Bulb, Black",18.99,FUR-104
EU-FUR-FU-10004289,"Deflect-O Stacking Tray, Black",25.35,FUR-104
EU-FUR-FU-10004313,"Eldon Light Bulb, Duo Pack",25.26,FUR-104
EU-FUR-FU-10004421,"Tenex Clock, Durable",47.28,FUR-104
EU-FUR-FU-10004422,"Advantus Photo Frame, Erganomic",51.60,FUR-104
EU-FUR-FU-10004459,"Deflect-O Door Stop, Erganomic",42.57,FUR-104
EU-FUR-FU-10004462,"Advantus Stacking Tray, Black",26.43,FUR-104
EU-FUR-FU-10004483,"Deflect-O Light Bulb, Durable",16.02,FUR-104
EU-FUR-FU-10004516,"Deflect-O Frame, Black",110.04,FUR-104
EU-FUR-FU-10004527,"Advantus Frame, Duo Pack",111.18,FUR-104
EU-FUR-FU-10004579,"Deflect-O Door Stop, Duo Pack",44.01,FUR-104
EU-FUR-FU-10004604,"Deflect-O Clock, Erganomic",48.93,FUR-104
EU-FUR-FU-10004608,"Advantus Door Stop, Erganomic",43.65,FUR-104
EU-FUR-FU-10004614,"Rubbermaid Frame, Black",109.89,FUR-104
EU-FUR-FU-10004640,"Tenex Light Bulb, Durable",15.96,FUR-104
EU-FUR-FU-10004689,"Advantus Light Bulb, Duo Pack",20.13,FUR-104
EU-FUR-FU-10004954,"Tenex Clock, Duo Pack",50.31,FUR-104
EU-FUR-FU-10004955,"Tenex Door Stop, Durable",40.92,FUR-104
EU-FUR-FU-10004960,"Deflect-O Photo Frame, Duo Pack",51.96,FUR-104
EU-FUR-TA-10000052,"Hon Training Table, Adjustable Height",334.89,FUR-103
EU-FUR-TA-10000115,"Barricks Coffee Table, Fully Assembled",302.97,FUR-103
EU-FUR-TA-10000184,"Barricks Conference Table, Fully Assembled",908.55,FUR-103
EU-FUR-TA-10000304,"Barricks Training Table, with Bottom Storage",318.30,FUR-103
EU-FUR-TA-10000323,"Lesro Round Table, Fully Assembled",453.48,FUR-103
EU-FUR-TA-10000347,"Hon Computer Table, Adjustable Height",489.81,FUR-103
EU-FUR-TA-10000403,"Barricks Wood Table, Adjustable Height",519.12,FUR-103
EU-FUR-TA-10000591,"Chromcraft Training Table, with Bottom Storage",283.89,FUR-103
EU-FUR-TA-10000861,"Barricks Conference Table, with Bottom Storage",907.08,FUR-103
EU-FUR-TA-10001228,"Bevis Training Table, Rectangular",332.55,FUR-103
EU-FUR-TA-10001664,"Chromcraft Conference Table, with Bottom Storage",872.67,FUR-103
EU-FUR-TA-10001693,"Bevis Training Table, with Bottom Storage",334.98,FUR-103
EU-FUR-TA-10001726,"Bevis Conference Table, with Bottom Storage",923.76,FUR-103
EU-FUR-TA-10001744,"Lesro Coffee Table, Adjustable Height",254.19,FUR-103
EU-FUR-TA-10001980,"Hon Wood Table, Rectangular",528.90,FUR-103
EU-FUR-TA-10002041,"Lesro Computer Table, Fully Assembled",429.81,FUR-103
EU-FUR-TA-10002411,"Hon Round Table, with Bottom Storage",515.91,FUR-103
EU-FUR-TA-10002467,"Lesro Conference Table, Adjustable Height",859.77,FUR-103
EU-FUR-TA-10002497,"Chromcraft Computer Table, Adjustable Height",445.62,FUR-103
EU-FUR-TA-10002523,"Barricks Training Table, Rectangular",315.87,FUR-103
EU-FUR-TA-10002544,"Barricks Training Table, Fully Assembled",319.77,FUR-103
EU-FUR-TA-10002557,"Barricks Conference Table, Rectangular",904.65,FUR-103
EU-FUR-TA-10002568,"Chromcraft Coffee Table, Rectangular",264.66,FUR-103
EU-FUR-TA-10002786,"Lesro Computer Table, Fully Assembled",428.34,FUR-103
EU-FUR-TA-10002789,"Hon Coffee Table, with Bottom Storage",315.90,FUR-103
EU-FUR-TA-10002868,"Barricks Coffee Table, Adjustable Height",303.69,FUR-103
EU-FUR-TA-10002912,"Lesro Conference Table, Fully Assembled",859.05,FUR-103
EU-FUR-TA-10002951,"Barricks Round Table, Adjustable Height",503.70,FUR-103
EU-FUR-TA-10003030,"Lesro Training Table, Adjustable Height",270.99,FUR-103
EU-FUR-TA-10003179,"Chromcraft Round Table, Adjustable Height",469.29,FUR-103
EU-FUR-TA-10003268,"Lesro Round Table, Rectangular",449.58,FUR-103
EU-FUR-TA-10003273,"Lesro Training Table, Rectangular",266.37,FUR-103
EU-FUR-TA-10003323,"Bevis Round Table, Adjustable Height",520.38,FUR-103
EU-FUR-TA-10003354,"Barricks Conference Table, Adjustable Height",909.27,FUR-103
