prodID,name,price,subCatID
EU-OFF-EN-10001979,"Cameo Clasp Envelope, Security-Tint",11.91,OFF-107
EU-OFF-EN-10001991,"Kraft Clasp Envelope, Set of 50",9.00,OFF-107
EU-OFF-EN-10001993,"GlobeWeis Manila Envelope, Set of 50",27.39,OFF-107
EU-OFF-EN-10001997,"GlobeWeis Business Envelopes, with clear poly window",20.88,OFF-107
EU-OFF-EN-10002008,"Cameo Mailers, Recycled",36.96,OFF-107
EU-OFF-EN-10002013,"Cameo Business Envelopes, Security-Tint",16.95,OFF-107
EU-OFF-EN-10002015,"GlobeWeis Peel and Seal, with clear poly window",24.93,OFF-107
EU-OFF-EN-10002065,"Ames Clasp Envelope, Set of 50",7.20,OFF-107
EU-OFF-EN-10002104,"Cameo Mailers, with clear poly window",41.70,OFF-107
EU-OFF-EN-10002240,"GlobeWeis Clasp Envelope, with clear poly window",13.44,OFF-107
EU-OFF-EN-10002313,"GlobeWeis Mailers, Recycled",37.35,OFF-107
EU-OFF-EN-10002406,"Kraft Business Envelopes, Recycled",18.84,OFF-107
EU-OFF-EN-10002410,"GlobeWeis Manila Envelope, Recycled",26.19,OFF-107
EU-OFF-EN-10002449,"Ames Interoffice Envelope, Security-Tint",47.52,OFF-107
EU-OFF-EN-10002465,"Cameo Business Envelopes, Set of 50",20.49,OFF-107
EU-OFF-EN-10002634,"Jiffy Clasp Envelope, Set of 50",8.52,OFF-107
EU-OFF-EN-10002723,"Cameo Interoffice Envelope, with clear poly window",50.97,OFF-107
EU-OFF-EN-10002728,"GlobeWeis Interoffice Envelope, Set of 50",47.82,OFF-107
EU-OFF-EN-10002736,"Cameo Clasp Envelope, with clear poly window",13.05,OFF-107
EU-OFF-EN-10002789,"Kraft Peel and Seal, Recycled",19.29,OFF-107
EU-OFF-EN-10002849,"Kraft Interoffice Envelope, with clear poly window",50.46,OFF-107
EU-OFF-EN-10002850,"Ames Manila Envelope, Recycled",23.49,OFF-107
EU-OFF-EN-10002873,"Ames Interoffice Envelope, Recycled",43.92,OFF-107
EU-OFF-EN-10002891,"GlobeWeis Mailers, with clear poly window",42.09,OFF-107
EU-OFF-EN-10002955,"Jiffy Interoffice Envelope, with clear poly window",49.98,OFF-107
EU-OFF-EN-10002961,"Kraft Clasp Envelope, Security-Tint",11.40,OFF-107
EU-OFF-EN-10003049,"GlobeWeis Clasp Envelope, Security-Tint",12.30,OFF-107
EU-OFF-EN-10003069,"Ames Mailers, Set of 50",35.85,OFF-107
EU-OFF-EN-10003073,"Jiffy Business Envelopes, Set of 50",19.50,OFF-107
EU-OFF-EN-10003080,"Kraft Peel and Seal, Security-Tint",22.89,OFF-107
EU-OFF-EN-10003087,"Jiffy Peel and Seal, Security-Tint",22.41,OFF-107
EU-OFF-EN-10003103,"GlobeWeis Manila Envelope, with clear poly window",30.93,OFF-107
EU-OFF-EN-10003177,"Kraft Interoffice Envelope, Recycled",45.72,OFF-107
EU-OFF-EN-10003271,"Ames Peel and Seal, Security-Tint",21.09,OFF-107
EU-OFF-EN-10003299,"Cameo Mailers, Security-Tint",40.56,OFF-107
EU-OFF-EN-10003360,"Kraft Mailers, with clear poly window",41.19,OFF-107
EU-OFF-EN-10003361,"GlobeWeis Manila Envelope, Security-Tint",29.79,OFF-107
EU-OFF-EN-10003373,"GlobeWeis Interoffice Envelope, Recycled",46.62,OFF-107
EU-OFF-EN-10003381,"Cameo Manila Envelope, Security-Tint",29.40,OFF-107
EU-OFF-EN-10003392,"Kraft Peel and Seal, Set of 50",20.49,OFF-107
EU-OFF-EN-10003431,"Cameo Interoffice Envelope, Security-Tint",49.83,OFF-107
EU-OFF-EN-10003444,"Jiffy Clasp Envelope, with clear poly window",12.06,OFF-107
EU-OFF-EN-10003448,"Cameo Clasp Envelope, Set of 50",9.51,OFF-107
EU-OFF-EN-10003465,"Cameo Peel and Seal, Security-Tint",23.40,OFF-107
EU-OFF-EN-10003484,"Ames Clasp Envelope, Recycled",6.00,OFF-107
EU-OFF-EN-10003511,"Jiffy Interoffice Envelope, Security-Tint",48.84,OFF-107
EU-OFF-EN-10003533,"Cameo Peel and Seal, Recycled",19.80,OFF-107
EU-OFF-EN-10003547,"Jiffy Interoffice Envelope, Set of 50",46.44,OFF-107
EU-OFF-EN-10003615,"GlobeWeis Interoffice Envelope, with clear poly window",51.36,OFF-107
EU-OFF-EN-10003630,"GlobeWeis Business Envelopes, Set of 50",17.34,OFF-107
EU-OFF-EN-10003669,"Jiffy Mailers, Security-Tint",39.57,OFF-107
EU-OFF-EN-10003737,"Kraft Business Envelopes, Set of 50",19.98,OFF-107
EU-OFF-EN-10003748,"Ames Mailers, with clear poly window",39.39,OFF-107
EU-OFF-EN-10003780,"Jiffy Peel and Seal, Recycled",18.81,OFF-107
EU-OFF-EN-10003785,"GlobeWeis Mailers, Set of 50",38.55,OFF-107
EU-OFF-EN-10003817,"Jiffy Business Envelopes, Security-Tint",15.96,OFF-107
EU-OFF-EN-10003834,"Cameo Business Envelopes, Recycled",19.35,OFF-107
EU-OFF-EN-10003854,"Jiffy Clasp Envelope, Security-Tint",10.92,OFF-107
EU-OFF-EN-10003858,"Jiffy Manila Envelope, Recycled",24.81,OFF-107
EU-OFF-EN-10003885,"Ames Interoffice Envelope, Set of 50",45.12,OFF-107
EU-OFF-EN-10003904,"Jiffy Business Envelopes, Recycled",14.76,OFF-107
EU-OFF-EN-10003933,"Kraft Manila Envelope, Security-Tint",28.89,OFF-107
EU-OFF-EN-10003936,"Cameo Peel and Seal, with clear poly window",24.54,OFF-107
EU-OFF-EN-10003962,"GlobeWeis Clasp Envelope, Set of 50",9.90,OFF-107
EU-OFF-EN-10003977,"Cameo Clasp Envelope, Recycled",8.31,OFF-107
EU-OFF-EN-10004051,"Ames Manila Envelope, Set of 50",24.69,OFF-107
EU-OFF-EN-10004074,"GlobeWeis Clasp Envelope, Recycled",8.70,OFF-107
EU-OFF-EN-10004120,"Jiffy Peel and Seal, Set of 50",20.01,OFF-107
EU-OFF-EN-10004150,"GlobeWeis Business Envelopes, Recycled",16.14,OFF-107
EU-OFF-EN-10004186,"Cameo Mailers, Set of 50",38.16,OFF-107
EU-OFF-EN-10004212,"Kraft Manila Envelope, Recycled",25.29,OFF-107
EU-OFF-EN-10004296,"GlobeWeis Mailers, Security-Tint",40.95,OFF-107
EU-OFF-EN-10004303,"Jiffy Mailers, Recycled",35.97,OFF-107
EU-OFF-EN-10004404,"Jiffy Manila Envelope, with clear poly window",29.55,OFF-107
EU-OFF-EN-10004491,"Cameo Manila Envelope, Recycled",25.80,OFF-107
EU-OFF-EN-10004571,"Ames Peel and Seal, with clear poly window",22.23,OFF-107
EU-OFF-EN-10004597,"GlobeWeis Peel and Seal, Set of 50",21.39,OFF-107
EU-OFF-EN-10004604,"Ames Peel and Seal, Set of 50",18.69,OFF-107
EU-OFF-EN-10004649,"Ames Mailers, Recycled",34.65,OFF-107
EU-OFF-EN-10004667,"Kraft Interoffice Envelope, Set of 50",46.92,OFF-107
EU-OFF-EN-10004677,"Jiffy Manila Envelope, Set of 50",26.01,OFF-107
EU-OFF-EN-10004759,"Cameo Interoffice Envelope, Recycled",46.23,OFF-107
EU-OFF-EN-10004775,"Kraft Manila Envelope, Set of 50",26.49,OFF-107
EU-OFF-EN-10004895,"Kraft Mailers, Security-Tint",40.05,OFF-107
EU-OFF-EN-10004904,"Cameo Manila Envelope, Set of 50",27.00,OFF-107
EU-OFF-EN-10004970,"GlobeWeis Peel and Seal, Security-Tint",23.79,OFF-107
EU-OFF-EN-10004981,"Ames Interoffice Envelope, with clear poly window",48.66,OFF-107
EU-OFF-FA-10000010,"OIC Staples, Metal",11.46,OFF-108
EU-OFF-FA-10000046,"Advantus Staples, Bulk Pack",10.86,OFF-108
EU-OFF-FA-10000067,"Stockwell Staples, 12 Pack",10.23,OFF-108
EU-OFF-FA-10000146,"Stockwell Rubber Bands, Assorted Sizes",13.98,OFF-108
EU-OFF-FA-10000154,"OIC Paper Clips, Bulk Pack",14.43,OFF-108
EU-OFF-FA-10000179,"Advantus Paper Clips, Metal",13.38,OFF-108
EU-OFF-FA-10000189,"OIC Paper Clips, 12 Pack",13.86,OFF-108
EU-OFF-FA-10000191,"Stockwell Rubber Bands, 12 Pack",15.57,OFF-108
EU-OFF-FA-10000227,"OIC Clamps, Metal",19.89,OFF-108
EU-OFF-FA-10000256,"Advantus Clamps, Bulk Pack",19.29,OFF-108
EU-OFF-FA-10000260,"Stockwell Push Pins, Metal",14.10,OFF-108
EU-OFF-FA-10000349,"OIC Push Pins, 12 Pack",14.34,OFF-108
EU-OFF-FA-10000411,"Accos Clamps, Assorted Sizes",16.83,OFF-108
EU-OFF-FA-10000429,"Stockwell Push Pins, Bulk Pack",14.37,OFF-108
EU-OFF-FA-10000474,"OIC Staples, 12 Pack",10.77,OFF-108
EU-OFF-FA-10000487,"Stockwell Paper Clips, Bulk Pack",14.01,OFF-108
EU-OFF-FA-10000520,"Stockwell Paper Clips, Bulk Pack",13.62,OFF-108
EU-OFF-FA-10000571,"Accos Rubber Bands, Assorted Sizes",14.13,OFF-108
EU-OFF-FA-10000659,"Stockwell Clamps, 12 Pack",18.27,OFF-108
EU-OFF-FA-10000670,"Advantus Clamps, Assorted Sizes",16.74,OFF-108
EU-OFF-FA-10000740,"Accos Staples, Bulk Pack",10.95,OFF-108
EU-OFF-FA-10000790,"Stockwell Rubber Bands, Bulk Pack",16.53,OFF-108
EU-OFF-FA-10000799,"OIC Push Pins, Bulk Pack",14.91,OFF-108
EU-OFF-FA-10000834,"Advantus Staples, Assorted Sizes",8.31,OFF-108
EU-OFF-FA-10000856,"Stockwell Thumb Tacks, Bulk Pack",13.53,OFF-108
EU-OFF-FA-10000999,"OIC Thumb Tacks, 12 Pack",13.50,OFF-108
EU-OFF-FA-10001026,"Stockwell Staples, Metal",10.92,OFF-108
EU-OFF-FA-10001030,"Stockwell Paper Clips, Assorted Sizes",13.89,OFF-108
EU-OFF-FA-10001051,"OIC Rubber Bands, Metal",17.19,OFF-108
EU-OFF-FA-10001052,"Stockwell Paper Clips, Assorted Sizes",11.34,OFF-108
EU-OFF-FA-10001054,"Advantus Thumb Tacks, Metal",13.71,OFF-108
EU-OFF-FA-10001097,"Accos Paper Clips, Assorted Sizes",11.49,OFF-108
EU-OFF-FA-10001113,"OIC Push Pins, Assorted Sizes",12.36,OFF-108
EU-OFF-FA-10001330,"OIC Rubber Bands, Bulk Pack",17.07,OFF-108
EU-OFF-FA-10001348,"Accos Thumb Tacks, Metal",13.80,OFF-108
EU-OFF-FA-10001359,"Stockwell Rubber Bands, Assorted Sizes",13.59,OFF-108
EU-OFF-FA-10001520,"Stockwell Thumb Tacks, 12 Pack",12.96,OFF-108
EU-OFF-FA-10001530,"Accos Paper Clips, Assorted Sizes",14.04,OFF-108
EU-OFF-FA-10001551,"Stockwell Thumb Tacks, 12 Pack",12.57,OFF-108
EU-OFF-FA-10001574,"Accos Clamps, Bulk Pack",19.38,OFF-108
EU-OFF-FA-10001577,"Stockwell Staples, Bulk Pack",10.80,OFF-108
EU-OFF-FA-10001613,"OIC Thumb Tacks, Bulk Pack",14.07,OFF-108
EU-OFF-FA-10001680,"OIC Push Pins, Metal",15.03,OFF-108
EU-OFF-FA-10001698,"Stockwell Clamps, Assorted Sizes",16.68,OFF-108
EU-OFF-FA-10001711,"Accos Rubber Bands, 12 Pack",16.11,OFF-108
EU-OFF-FA-10001724,"Advantus Paper Clips, Assorted Sizes",11.40,OFF-108
EU-OFF-FA-10001783,"Stockwell Rubber Bands, Metal",16.65,OFF-108
EU-OFF-FA-10001800,"Accos Paper Clips, Metal",13.47,OFF-108
EU-OFF-FA-10001892,"Advantus Clamps, Metal",19.41,OFF-108
EU-OFF-FA-10002017,"Stockwell Paper Clips, Assorted Sizes",10.95,OFF-108
EU-OFF-FA-10002045,"Accos Rubber Bands, Metal",16.80,OFF-108
EU-OFF-FA-10002047,"Stockwell Push Pins, Bulk Pack",13.98,OFF-108
EU-OFF-FA-10002066,"OIC Clamps, Bulk Pack",19.77,OFF-108
EU-OFF-FA-10002071,"Accos Thumb Tacks, Assorted Sizes",11.13,OFF-108
EU-OFF-FA-10002226,"Stockwell Thumb Tacks, Metal",13.26,OFF-108
EU-OFF-FA-10002248,"Stockwell Staples, Assorted Sizes",8.25,OFF-108
EU-OFF-FA-10002264,"Advantus Rubber Bands, Assorted Sizes",14.04,OFF-108
EU-OFF-FA-10002308,"Accos Push Pins, Assorted Sizes",11.97,OFF-108
EU-OFF-FA-10002350,"OIC Staples, Assorted Sizes",8.79,OFF-108
EU-OFF-FA-10002393,"Accos Push Pins, Bulk Pack",14.52,OFF-108
EU-OFF-FA-10002506,"OIC Rubber Bands, 12 Pack",16.50,OFF-108
EU-OFF-FA-10002531,"Advantus Paper Clips, Bulk Pack",14.07,OFF-108
EU-OFF-FA-10002577,"Stockwell Push Pins, 12 Pack",13.41,OFF-108
EU-OFF-FA-10002600,"Accos Thumb Tacks, 12 Pack",13.11,OFF-108
EU-OFF-FA-10002619,"Stockwell Rubber Bands, Metal",16.26,OFF-108
EU-OFF-FA-10002652,"Stockwell Staples, Bulk Pack",10.41,OFF-108
EU-OFF-FA-10002683,"Stockwell Staples, Assorted Sizes",7.86,OFF-108
EU-OFF-FA-10002715,"Stockwell Clamps, 12 Pack",18.66,OFF-108
EU-OFF-FA-10002728,"Advantus Paper Clips, Assorted Sizes",13.95,OFF-108
EU-OFF-FA-10002752,"Advantus Push Pins, Bulk Pack",14.43,OFF-108
EU-OFF-FA-10002759,"Stockwell Clamps, Bulk Pack",19.23,OFF-108
EU-OFF-FA-10002803,"Accos Staples, Metal",11.07,OFF-108
EU-OFF-FA-10002895,"Accos Staples, 12 Pack",10.38,OFF-108
EU-OFF-FA-10002964,"Accos Clamps, 12 Pack",18.81,OFF-108
EU-OFF-FA-10003139,"Advantus Push Pins, Assorted Sizes",11.88,OFF-108
EU-OFF-FA-10003411,"OIC Staples, Bulk Pack",11.34,OFF-108
EU-OFF-FA-10003462,"Stockwell Thumb Tacks, Assorted Sizes",10.59,OFF-108
EU-OFF-FA-10003463,"OIC Thumb Tacks, Assorted Sizes",11.52,OFF-108
EU-OFF-FA-10003505,"OIC Thumb Tacks, Metal",14.19,OFF-108
EU-OFF-FA-10003531,"Accos Thumb Tacks, Bulk Pack",13.68,OFF-108
EU-OFF-FA-10003717,"Stockwell Clamps, Metal",19.35,OFF-108
EU-OFF-FA-10003730,"Stockwell Thumb Tacks, Bulk Pack",13.14,OFF-108
EU-OFF-FA-10003744,"Stockwell Thumb Tacks, Assorted Sizes",10.98,OFF-108
EU-OFF-FA-10003789,"Accos Push Pins, Metal",14.64,OFF-108
EU-OFF-FA-10003818,"Stockwell Staples, 12 Pack",9.84,OFF-108
EU-OFF-FA-10003836,"Stockwell Rubber Bands, 12 Pack",15.96,OFF-108
EU-OFF-FA-10003930,"Stockwell Push Pins, Assorted Sizes",11.82,OFF-108
EU-OFF-FA-10003931,"Stockwell Push Pins, 12 Pack",13.80,OFF-108
EU-OFF-FA-10003990,"Stockwell Clamps, Metal",18.96,OFF-108
EU-OFF-FA-10004139,"Advantus Thumb Tacks, 12 Pack",13.02,OFF-108
EU-OFF-FA-10004140,"Accos Push Pins, 12 Pack",13.95,OFF-108
EU-OFF-FA-10004175,"Stockwell Push Pins, Assorted Sizes",11.43,OFF-108
EU-OFF-FA-10004233,"Stockwell Paper Clips, Metal",13.32,OFF-108
EU-OFF-FA-10004239,"Advantus Staples, Metal",10.98,OFF-108
EU-OFF-FA-10004257,"Accos Clamps, Metal",19.50,OFF-108
EU-OFF-FA-10004310,"Advantus Staples, 12 Pack",10.29,OFF-108
EU-OFF-FA-10004339,"Stockwell Staples, Metal",10.53,OFF-108
EU-OFF-FA-10004344,"Advantus Thumb Tacks, Assorted Sizes",11.04,OFF-108
EU-OFF-FA-10004359,"OIC Paper Clips, Assorted Sizes",11.88,OFF-108
EU-OFF-FA-10004424,"Advantus Clamps, 12 Pack",18.72,OFF-108
EU-OFF-FA-10004474,"Advantus Rubber Bands, Metal",16.71,OFF-108
EU-OFF-FA-10004494,"Stockwell Push Pins, Metal",14.49,OFF-108
EU-OFF-FA-10004503,"Accos Staples, Assorted Sizes",8.40,OFF-108
EU-OFF-FA-10004605,"OIC Clamps, Assorted Sizes",17.22,OFF-108
EU-OFF-FA-10004657,"Stockwell Thumb Tacks, Metal",13.65,OFF-108
EU-OFF-FA-10004665,"Stockwell Paper Clips, Metal",12.93,OFF-108
EU-OFF-FA-10004709,"Stockwell Clamps, Assorted Sizes",16.29,OFF-108
EU-OFF-FA-10004734,"Advantus Rubber Bands, Bulk Pack",16.59,OFF-108
EU-OFF-FA-10004754,"Advantus Rubber Bands, 12 Pack",16.02,OFF-108
EU-OFF-FA-10004799,"Advantus Thumb Tacks, Bulk Pack",13.59,OFF-108
EU-OFF-FA-10004824,"Stockwell Rubber Bands, Bulk Pack",16.14,OFF-108
EU-OFF-FA-10004878,"Stockwell Clamps, Bulk Pack",18.84,OFF-108
EU-OFF-FA-10004880,"Accos Rubber Bands, Bulk Pack",16.68,OFF-108
EU-OFF-FA-10004899,"OIC Clamps, 12 Pack",19.20,OFF-108
EU-OFF-FA-10004993,"OIC Paper Clips, Metal",14.55,OFF-108
EU-OFF-FA-10004997,"Accos Paper Clips, Bulk Pack",14.16,OFF-108
EU-OFF-LA-10000039,"Smead Legal Exhibit Labels, Adjustable",9.00,OFF-101
EU-OFF-LA-10000134,"Harbour Creations Removable Labels, 5000 Label Set",10.35,OFF-101
EU-OFF-LA-10000155,"Novimex Round Labels, Alphabetical",6.09,OFF-101
EU-OFF-LA-10000157,"Novimex Shipping Labels, Laser Printer Compatible",10.98,OFF-101
EU-OFF-LA-10000296,"Hon Color Coded Labels, Adjustable",10.71,OFF-101
EU-OFF-LA-10000321,"Novimex Color Coded Labels, Adjustable",10.32,OFF-101
EU-OFF-LA-10000341,"Smead Shipping Labels, 5000 Label Set",12.00,OFF-101
EU-OFF-LA-10000356,"Novimex Round Labels, 5000 Label Set",6.66,OFF-101
EU-OFF-LA-10000379,"Harbour Creations Legal Exhibit Labels, 5000 Label Set",11.34,OFF-101
EU-OFF-LA-10000404,"Smead Shipping Labels, Laser Printer Compatible",11.61,OFF-101
EU-OFF-LA-10000425,"Smead Legal Exhibit Labels, Alphabetical",10.92,OFF-101
EU-OFF-LA-10000508,"Harbour Creations Round Labels, 5000 Label Set",7.14,OFF-101
EU-OFF-LA-10000519,"Novimex File Folder Labels, Laser Printer Compatible",8.25,OFF-101
EU-OFF-LA-10000536,"Smead Color Coded Labels, Laser Printer Compatible",13.05,OFF-101
EU-OFF-LA-10000553,"Hon Round Labels, Laser Printer Compatible",6.66,OFF-101
EU-OFF-LA-10000604,"Harbour Creations Color Coded Labels, Laser Printer Compatible",12.90,OFF-101
EU-OFF-LA-10000648,"Harbour Creations Round Labels, Alphabetical",6.57,OFF-101
EU-OFF-LA-10000685,"Avery Shipping Labels, Laser Printer Compatible",11.85,OFF-101
EU-OFF-LA-10000700,"Avery Legal Exhibit Labels, Laser Printer Compatible",11.34,OFF-101
EU-OFF-LA-10000707,"Avery Legal Exhibit Labels, Adjustable",9.24,OFF-101
EU-OFF-LA-10000709,"Avery Color Coded Labels, Alphabetical",13.11,OFF-101
EU-OFF-LA-10000760,"Harbour Creations Removable Labels, Laser Printer Compatible",10.17,OFF-101
EU-OFF-LA-10000767,"Hon Legal Exhibit Labels, Laser Printer Compatible",10.86,OFF-101
EU-OFF-LA-10000880,"Novimex Removable Labels, 5000 Label Set",9.87,OFF-101
EU-OFF-LA-10001075,"Hon Removable Labels, Laser Printer Compatible",10.08,OFF-101
EU-OFF-LA-10001154,"Hon Shipping Labels, Adjustable",9.27,OFF-101
EU-OFF-LA-10001169,"Harbour Creations Round Labels, Laser Printer Compatible",6.75,OFF-101
EU-OFF-LA-10001170,"Harbour Creations Color Coded Labels, 5000 Label Set",13.29,OFF-101
EU-OFF-LA-10001184,"Novimex Legal Exhibit Labels, 5000 Label Set",10.86,OFF-101
EU-OFF-LA-10001188,"Novimex Shipping Labels, Adjustable",8.88,OFF-101
EU-OFF-LA-10001194,"Novimex Removable Labels, Adjustable",7.77,OFF-101
EU-OFF-LA-10001265,"Hon File Folder Labels, Alphabetical",8.46,OFF-101
EU-OFF-LA-10001284,"Smead Round Labels, 5000 Label Set",7.29,OFF-101
EU-OFF-LA-10001299,"Avery File Folder Labels, Adjustable",7.02,OFF-101
EU-OFF-LA-10001375,"Smead Removable Labels, 5000 Label Set",10.50,OFF-101
EU-OFF-LA-10001402,"Smead Color Coded Labels, 5000 Label Set",13.44,OFF-101
EU-OFF-LA-10001413,"Hon Shipping Labels, Laser Printer Compatible",11.37,OFF-101
EU-OFF-LA-10001541,"Avery Removable Labels, 5000 Label Set",11.13,OFF-101
EU-OFF-LA-10001546,"Avery Shipping Labels, Adjustable",9.75,OFF-101
EU-OFF-LA-10001549,"Harbour Creations Removable Labels, Adjustable",10.74,OFF-101
EU-OFF-LA-10001607,"Novimex Shipping Labels, Alphabetical",10.80,OFF-101
EU-OFF-LA-10001618,"Hon Legal Exhibit Labels, Adjustable",8.76,OFF-101
EU-OFF-LA-10001633,"Novimex File Folder Labels, 5000 Label Set",8.64,OFF-101
EU-OFF-LA-10001676,"Hon Removable Labels, Adjustable",8.16,OFF-101
EU-OFF-LA-10001738,"Novimex Color Coded Labels, Alphabetical",12.24,OFF-101
EU-OFF-LA-10001793,"Avery Round Labels, Alphabetical",6.96,OFF-101
EU-OFF-LA-10001831,"Harbour Creations Shipping Labels, Adjustable",9.36,OFF-101
EU-OFF-LA-10001833,"Hon Shipping Labels, Alphabetical",11.19,OFF-101
EU-OFF-LA-10001915,"Avery Legal Exhibit Labels, 5000 Label Set",11.73,OFF-101
EU-OFF-LA-10002029,"Hon Round Labels, 5000 Label Set",7.05,OFF-101
EU-OFF-LA-10002159,"Hon Removable Labels, Adjustable",10.65,OFF-101
EU-OFF-LA-10002225,"Hon Shipping Labels, 5000 Label Set",11.76,OFF-101
EU-OFF-LA-10002324,"Smead Removable Labels, Adjustable",8.40,OFF-101
EU-OFF-LA-10002325,"Smead Removable Labels, Adjustable",10.89,OFF-101
EU-OFF-LA-10002334,"Novimex Removable Labels, Adjustable",10.26,OFF-101
EU-OFF-LA-10002353,"Harbour Creations Legal Exhibit Labels, Laser Printer Compatible",10.95,OFF-101
EU-OFF-LA-10002486,"Harbour Creations Legal Exhibit Labels, Adjustable",8.85,OFF-101
EU-OFF-LA-10002490,"Hon Round Labels, Alphabetical",6.48,OFF-101
EU-OFF-LA-10002559,"Smead File Folder Labels, Alphabetical",8.70,OFF-101
EU-OFF-LA-10002625,"Harbour Creations Round Labels, Adjustable",4.65,OFF-101
EU-OFF-LA-10002651,"Novimex Round Labels, Adjustable",4.17,OFF-101
EU-OFF-LA-10002733,"Novimex File Folder Labels, Alphabetical",8.07,OFF-101
EU-OFF-LA-10002752,"Smead Legal Exhibit Labels, 5000 Label Set",11.49,OFF-101
EU-OFF-LA-10002805,"Hon Color Coded Labels, Alphabetical",12.63,OFF-101
EU-OFF-LA-10002900,"Harbour Creations File Folder Labels, Alphabetical",8.55,OFF-101
EU-OFF-LA-10002943,"Novimex Removable Labels, Laser Printer Compatible",9.69,OFF-101
EU-OFF-LA-10002964,"Harbour Creations Shipping Labels, 5000 Label Set",11.85,OFF-101
EU-OFF-LA-10002974,"Avery File Folder Labels, Laser Printer Compatible",9.12,OFF-101
EU-OFF-LA-10002995,"Avery Removable Labels, Adjustable",8.64,OFF-101
EU-OFF-LA-10002996,"Avery Removable Labels, Laser Printer Compatible",10.74,OFF-101
EU-OFF-LA-10003058,"Novimex Legal Exhibit Labels, Adjustable",8.37,OFF-101
EU-OFF-LA-10003084,"Avery File Folder Labels, Alphabetical",8.94,OFF-101
EU-OFF-LA-10003090,"Harbour Creations File Folder Labels, Adjustable",6.63,OFF-101
EU-OFF-LA-10003132,"Smead Round Labels, Laser Printer Compatible",6.90,OFF-101
EU-OFF-LA-10003210,"Novimex Color Coded Labels, 5000 Label Set",12.81,OFF-101
EU-OFF-LA-10003217,"Smead File Folder Labels, Laser Printer Compatible",8.88,OFF-101
EU-OFF-LA-10003231,"Smead Round Labels, Adjustable",4.80,OFF-101
EU-OFF-LA-10003233,"Avery Removable Labels, Alphabetical",10.56,OFF-101
EU-OFF-LA-10003278,"Novimex Shipping Labels, 5000 Label Set",11.37,OFF-101
EU-OFF-LA-10003283,"Harbour Creations Removable Labels, Adjustable",8.25,OFF-101
EU-OFF-LA-10003290,"Hon Round Labels, Adjustable",4.56,OFF-101
EU-OFF-LA-10003295,"Harbour Creations Color Coded Labels, Alphabetical",12.72,OFF-101
EU-OFF-LA-10003390,"Harbour Creations File Folder Labels, 5000 Label Set",9.12,OFF-101
EU-OFF-LA-10003511,"Avery Round Labels, Adjustable",5.04,OFF-101
EU-OFF-LA-10003591,"Smead Removable Labels, Laser Printer Compatible",10.32,OFF-101
EU-OFF-LA-10003699,"Smead File Folder Labels, Adjustable",6.78,OFF-101
EU-OFF-LA-10003795,"Smead Round Labels, Alphabetical",6.72,OFF-101
EU-OFF-LA-10003827,"Avery Color Coded Labels, 5000 Label Set",13.68,OFF-101
EU-OFF-LA-10003967,"Smead Color Coded Labels, Adjustable",10.95,OFF-101
EU-OFF-LA-10003969,"Novimex Legal Exhibit Labels, Laser Printer Compatible",10.47,OFF-101
EU-OFF-LA-10004007,"Harbour Creations Color Coded Labels, Adjustable",10.80,OFF-101
EU-OFF-LA-10004020,"Hon Color Coded Labels, 5000 Label Set",13.20,OFF-101
EU-OFF-LA-10004050,"Hon Color Coded Labels, Laser Printer Compatible",12.81,OFF-101
EU-OFF-LA-10004058,"Hon Legal Exhibit Labels, 5000 Label Set",11.25,OFF-101
EU-OFF-LA-10004108,"Avery Round Labels, 5000 Label Set",7.53,OFF-101
EU-OFF-LA-10004122,"Avery Color Coded Labels, Laser Printer Compatible",13.29,OFF-101
EU-OFF-LA-10004132,"Smead Color Coded Labels, Alphabetical",12.87,OFF-101
EU-OFF-LA-10004148,"Smead File Folder Labels, 5000 Label Set",9.27,OFF-101
EU-OFF-LA-10004280,"Harbour Creations Legal Exhibit Labels, Alphabetical",10.77,OFF-101
EU-OFF-LA-10004285,"Smead Legal Exhibit Labels, Laser Printer Compatible",11.10,OFF-101
EU-OFF-LA-10004332,"Novimex File Folder Labels, Adjustable",6.15,OFF-101
EU-OFF-LA-10004487,"Harbour Creations Shipping Labels, Alphabetical",11.28,OFF-101
EU-OFF-LA-10004594,"Avery Color Coded Labels, Adjustable",11.19,OFF-101
EU-OFF-LA-10004709,"Avery Round Labels, Laser Printer Compatible",7.14,OFF-101
EU-OFF-LA-10004727,"Hon File Folder Labels, Laser Printer Compatible",8.64,OFF-101
EU-OFF-LA-10004737,"Avery Shipping Labels, 5000 Label Set",12.24,OFF-101
EU-OFF-LA-10004744,"Smead Shipping Labels, Alphabetical",11.43,OFF-101
EU-OFF-LA-10004753,"Novimex Round Labels, Laser Printer Compatible",6.27,OFF-101
EU-OFF-LA-10004774,"Avery Shipping Labels, Alphabetical",11.67,OFF-101
EU-OFF-LA-10004799,"Hon Legal Exhibit Labels, Alphabetical",10.68,OFF-101
EU-OFF-LA-10004832,"Novimex Legal Exhibit Labels, Alphabetical",10.29,OFF-101
EU-OFF-LA-10004859,"Avery Legal Exhibit Labels, Alphabetical",11.16,OFF-101
EU-OFF-LA-10004929,"Novimex Color Coded Labels, Laser Printer Compatible",12.42,OFF-101
EU-OFF-LA-10004964,"Smead Shipping Labels, Adjustable",9.51,OFF-101
EU-OFF-LA-10004972,"Avery File Folder Labels, 5000 Label Set",9.51,OFF-101
EU-OFF-PA-10000034,"Xerox Cards & Envelopes, Multicolor",46.38,OFF-106
EU-OFF-PA-10000098,"Xerox Parchment Paper, 8.5 x 11",17.40,OFF-106
EU-OFF-PA-10000277,"SanDisk Computer Printout Paper, Premium",29.79,OFF-106
EU-OFF-PA-10000300,"Green Bar Cards & Envelopes, Premium",48.39,OFF-106
EU-OFF-PA-10000301,"Enermax Parchment Paper, Premium",15.39,OFF-106
EU-OFF-PA-10000317,"Xerox Computer Printout Paper, Premium",26.34,OFF-106
EU-OFF-PA-10000393,"Xerox Memo Slips, 8.5 x 11",17.67,OFF-106
EU-OFF-PA-10000423,"Enermax Computer Printout Paper, Recycled",28.38,OFF-106
EU-OFF-PA-10000450,"Green Bar Note Cards, Multicolor",33.93,OFF-106
EU-OFF-PA-10000522,"Green Bar Message Books, Multicolor",25.20,OFF-106
EU-OFF-PA-10000562,"Enermax Message Books, Multicolor",23.91,OFF-106
EU-OFF-PA-10000756,"Enermax Computer Printout Paper, Premium",28.47,OFF-106
EU-OFF-PA-10000816,"Enermax Memo Slips, Recycled",15.57,OFF-106
EU-OFF-PA-10000827,"Enermax Message Books, 8.5 x 11",26.64,OFF-106
EU-OFF-PA-10000850,"SanDisk Parchment Paper, Multicolor",18.12,OFF-106
EU-OFF-PA-10000871,"Enermax Cards & Envelopes, Recycled",47.01,OFF-106
EU-OFF-PA-10000876,"Eaton Computer Printout Paper, Multicolor",27.96,OFF-106
EU-OFF-PA-10000878,"SanDisk Note Cards, Multicolor",33.96,OFF-106
EU-OFF-PA-10000908,"Xerox Note Cards, Premium",26.37,OFF-106
EU-OFF-PA-10000961,"Green Bar Parchment Paper, Premium",16.68,OFF-106
EU-OFF-PA-10001212,"Xerox Message Books, Recycled",20.28,OFF-106
EU-OFF-PA-10001223,"SanDisk Cards & Envelopes, Premium",48.42,OFF-106
EU-OFF-PA-10001294,"Enermax Cards & Envelopes, Multicolor",48.51,OFF-106
EU-OFF-PA-10001301,"SanDisk Computer Printout Paper, Multicolor",31.20,OFF-106
EU-OFF-PA-10001323,"Eaton Note Cards, 8.5 x 11",26.49,OFF-106
EU-OFF-PA-10001348,"Eaton Note Cards, Multicolor",30.72,OFF-106
EU-OFF-PA-10001371,"Xerox Computer Printout Paper, 8.5 x 11",30.48,OFF-106
EU-OFF-PA-10001445,"Eaton Cards & Envelopes, Multicolor",46.59,OFF-106
EU-OFF-PA-10001466,"Eaton Computer Printout Paper, 8.5 x 11",30.69,OFF-106
EU-OFF-PA-10001492,"Enermax Note Cards, Premium",29.91,OFF-106
EU-OFF-PA-10001497,"Xerox Note Cards, 8.5 x 11",30.51,OFF-106
EU-OFF-PA-10001523,"Enermax Cards & Envelopes, Premium",47.10,OFF-106
EU-OFF-PA-10001536,"SanDisk Message Books, 8.5 x 11",27.96,OFF-106
EU-OFF-PA-10001537,"Green Bar Note Cards, 8.5 x 11",29.70,OFF-106
EU-OFF-PA-10001595,"Enermax Memo Slips, 8.5 x 11",19.80,OFF-106
EU-OFF-PA-10001620,"SanDisk Memo Slips, Recycled",16.89,OFF-106
EU-OFF-PA-10001650,"Xerox Message Books, Premium",20.37,OFF-106
EU-OFF-PA-10001661,"SanDisk Computer Printout Paper, 8.5 x 11",33.93,OFF-106
EU-OFF-PA-10001662,"Green Bar Note Cards, Premium",29.79,OFF-106
EU-OFF-PA-10001686,"SanDisk Memo Slips, Premium",16.98,OFF-106
EU-OFF-PA-10001722,"SanDisk Message Books, Premium",23.82,OFF-106
EU-OFF-PA-10001735,"Xerox Cards & Envelopes, 8.5 x 11",49.11,OFF-106
EU-OFF-PA-10001736,"SanDisk Note Cards, 8.5 x 11",29.73,OFF-106
EU-OFF-PA-10001758,"Enermax Note Cards, Premium",28.50,OFF-106
EU-OFF-PA-10001795,"Green Bar Message Books, Premium",23.79,OFF-106
EU-OFF-PA-10001844,"Eaton Message Books, 8.5 x 11",24.72,OFF-106
EU-OFF-PA-10001858,"SanDisk Message Books, Multicolor",25.23,OFF-106
EU-OFF-PA-10001869,"Green Bar Computer Printout Paper, 8.5 x 11",33.90,OFF-106
EU-OFF-PA-10001905,"Eaton Message Books, Recycled",20.49,OFF-106
EU-OFF-PA-10001971,"Eaton Cards & Envelopes, Premium",45.18,OFF-106
