prodID,name,price,subCatID
EU-TEC-AC-10004791,"Belkin Keyboard, USB",84.09,TEC-102
EU-TEC-AC-10004808,"Memorex Router, Erganomic",244.02,TEC-102
EU-TEC-AC-10004811,"Memorex Flash Drive, USB",29.61,TEC-102
EU-TEC-AC-10004849,"SanDisk Router, Programmable",257.85,TEC-102
EU-TEC-AC-10004880,"Logitech Keyboard, Programmable",73.95,TEC-102
EU-TEC-AC-10004883,"Enermax Keyboard, Programmable",84.96,TEC-102
EU-TEC-AC-10004997,"Belkin Memory Card, Bluetooth",114.81,TEC-102
EU-TEC-CO-10000011,"HP Personal Copier, High-Speed",122.49,TEC-104
EU-TEC-CO-10000013,"Brother Fax Machine, Laser",318.54,TEC-104
EU-TEC-CO-10000070,"Hewlett Copy Machine, High-Speed",263.67,TEC-104
EU-TEC-CO-10000082,"Canon Fax and Copier, Digital",190.98,TEC-104
EU-TEC-CO-10000119,"HP Fax Machine, Color",301.38,TEC-104
EU-TEC-CO-10000178,"Hewlett Ink, Laser",148.68,TEC-104
EU-TEC-CO-10000228,"Hewlett Personal Copier, Laser",144.27,TEC-104
EU-TEC-CO-10000263,"Hewlett Fax Machine, Digital",319.56,TEC-104
EU-TEC-CO-10000270,"Hewlett Fax Machine, High-Speed",318.12,TEC-104
EU-TEC-CO-10000279,"Hewlett Personal Copier, High-Speed",142.47,TEC-104
EU-TEC-CO-10000338,"Hewlett Fax and Copier, High-Speed",191.07,TEC-104
EU-TEC-CO-10000405,"Canon Fax Machine, Digital",318.03,TEC-104
EU-TEC-CO-10000407,"HP Copy Machine, Color",241.89,TEC-104
EU-TEC-CO-10000500,"Canon Fax and Copier, High-Speed",189.54,TEC-104
EU-TEC-CO-10000556,"HP Wireless Fax, Laser",360.21,TEC-104
EU-TEC-CO-10000620,"Brother Wireless Fax, Digital",378.45,TEC-104
EU-TEC-CO-10000660,"Hewlett Copy Machine, Color",261.87,TEC-104
EU-TEC-CO-10000775,"Sharp Fax and Copier, Laser",168.60,TEC-104
EU-TEC-CO-10000777,"Brother Personal Copier, Laser",142.89,TEC-104
EU-TEC-CO-10000854,"Canon Personal Copier, Color",144.18,TEC-104
EU-TEC-CO-10000967,"HP Fax Machine, Laser",299.94,TEC-104
EU-TEC-CO-10001008,"Canon Fax and Copier, Laser",191.34,TEC-104
EU-TEC-CO-10001142,"Brother Ink, Digital",146.94,TEC-104
EU-TEC-CO-10001145,"Canon Personal Copier, Digital",142.38,TEC-104
EU-TEC-CO-10001162,"Canon Wireless Fax, Laser",378.66,TEC-104
EU-TEC-CO-10001191,"Sharp Wireless Fax, High-Speed",354.12,TEC-104
EU-TEC-CO-10001192,"HP Personal Copier, Digital",123.93,TEC-104
EU-TEC-CO-10001342,"HP Wireless Fax, Digital",359.85,TEC-104
EU-TEC-CO-10001375,"Brother Copy Machine, Color",263.73,TEC-104
EU-TEC-CO-10001413,"Hewlett Wireless Fax, High-Speed",378.39,TEC-104
EU-TEC-CO-10001425,"HP Personal Copier, Color",125.73,TEC-104
EU-TEC-CO-10001487,"Canon Ink, Digital",146.79,TEC-104
EU-TEC-CO-10001523,"HP Copy Machine, High-Speed",243.69,TEC-104
EU-TEC-CO-10001567,"Brother Copy Machine, Laser",261.93,TEC-104
EU-TEC-CO-10001596,"Brother Wireless Fax, Color",380.25,TEC-104
EU-TEC-CO-10001628,"Sharp Personal Copier, Digital",119.64,TEC-104
EU-TEC-CO-10001629,"Sharp Copy Machine, Color",240.84,TEC-104
EU-TEC-CO-10001633,"Sharp Fax Machine, High-Speed",293.85,TEC-104
EU-TEC-CO-10001678,"Brother Fax Machine, Digital",318.18,TEC-104
EU-TEC-CO-10001795,"Sharp Personal Copier, High-Speed",118.20,TEC-104
EU-TEC-CO-10001831,"Sharp Personal Copier, Laser",120.00,TEC-104
EU-TEC-CO-10001839,"Hewlett Fax and Copier, Laser",192.87,TEC-104
EU-TEC-CO-10001894,"Sharp Copy Machine, High-Speed",239.40,TEC-104
EU-TEC-CO-10001926,"Hewlett Wireless Fax, Laser",380.19,TEC-104
EU-TEC-CO-10001952,"Hewlett Personal Copier, Digital",143.91,TEC-104
EU-TEC-CO-10002043,"Canon Wireless Fax, Digital",378.30,TEC-104
EU-TEC-CO-10002055,"Hewlett Ink, Digital",148.32,TEC-104
EU-TEC-CO-10002083,"HP Fax and Copier, High-Speed",171.09,TEC-104
EU-TEC-CO-10002157,"Canon Fax Machine, Laser",318.39,TEC-104
EU-TEC-CO-10002174,"HP Copy Machine, Laser",243.33,TEC-104
EU-TEC-CO-10002232,"HP Ink, Laser",128.70,TEC-104
EU-TEC-CO-10002240,"Canon Copy Machine, High-Speed",260.34,TEC-104
EU-TEC-CO-10002242,"Brother Fax and Copier, Color",192.93,TEC-104
EU-TEC-CO-10002244,"Sharp Ink, Laser",124.41,TEC-104
EU-TEC-CO-10002269,"Brother Ink, Color",148.74,TEC-104
EU-TEC-CO-10002284,"Hewlett Copy Machine, Color",265.11,TEC-104
EU-TEC-CO-10002323,"Brother Copy Machine, Color",260.49,TEC-104
EU-TEC-CO-10002326,"Canon Copy Machine, Color",263.58,TEC-104
EU-TEC-CO-10002423,"Canon Personal Copier, High-Speed",140.94,TEC-104
EU-TEC-CO-10002466,"Brother Personal Copier, High-Speed",141.09,TEC-104
EU-TEC-CO-10002550,"Sharp Ink, Digital",124.05,TEC-104
EU-TEC-CO-10002583,"Canon Fax and Copier, Color",192.78,TEC-104
EU-TEC-CO-10002601,"Brother Fax and Copier, Digital",191.13,TEC-104
EU-TEC-CO-10002659,"Sharp Fax Machine, Color",297.09,TEC-104
EU-TEC-CO-10002663,"Sharp Wireless Fax, Laser",355.92,TEC-104
EU-TEC-CO-10002673,"Brother Fax and Copier, Laser",191.49,TEC-104
EU-TEC-CO-10002686,"Hewlett Fax Machine, Laser",319.92,TEC-104
EU-TEC-CO-10002769,"HP Fax Machine, Digital",299.58,TEC-104
EU-TEC-CO-10002796,"Canon Wireless Fax, Color",380.10,TEC-104
EU-TEC-CO-10002817,"Sharp Fax and Copier, Digital",168.24,TEC-104
EU-TEC-CO-10002857,"Sharp Fax and Copier, Color",170.04,TEC-104
EU-TEC-CO-10002872,"Canon Ink, Color",148.59,TEC-104
EU-TEC-CO-10002916,"Hewlett Ink, Color",150.12,TEC-104
EU-TEC-CO-10002937,"Canon Ink, High-Speed",145.35,TEC-104
EU-TEC-CO-10002962,"Sharp Wireless Fax, Color",357.36,TEC-104
EU-TEC-CO-10002981,"HP Wireless Fax, High-Speed",358.41,TEC-104
EU-TEC-CO-10003083,"HP Fax Machine, High-Speed",298.14,TEC-104
EU-TEC-CO-10003124,"Canon Ink, Laser",147.15,TEC-104
EU-TEC-CO-10003228,"Hewlett Copy Machine, Laser",263.31,TEC-104
EU-TEC-CO-10003268,"HP Fax and Copier, Color",174.33,TEC-104
EU-TEC-CO-10003298,"Hewlett Wireless Fax, Digital",379.83,TEC-104
EU-TEC-CO-10003307,"Hewlett Fax and Copier, Digital",192.51,TEC-104
EU-TEC-CO-10003342,"Canon Wireless Fax, High-Speed",376.86,TEC-104
EU-TEC-CO-10003362,"Sharp Fax and Copier, High-Speed",166.80,TEC-104
EU-TEC-CO-10003406,"HP Fax and Copier, Laser",172.89,TEC-104
EU-TEC-CO-10003471,"Hewlett Fax and Copier, Color",194.31,TEC-104
EU-TEC-CO-10003474,"Brother Personal Copier, Digital",142.53,TEC-104
EU-TEC-CO-10003516,"Sharp Ink, High-Speed",122.61,TEC-104
EU-TEC-CO-10003523,"Brother Wireless Fax, High-Speed",377.01,TEC-104
EU-TEC-CO-10003525,"Sharp Ink, Color",125.85,TEC-104
EU-TEC-CO-10003534,"HP Fax and Copier, Digital",172.53,TEC-104
EU-TEC-CO-10003597,"Brother Copy Machine, High-Speed",262.29,TEC-104
EU-TEC-CO-10003608,"Canon Fax Machine, Color",319.83,TEC-104
EU-TEC-CO-10003800,"Hewlett Wireless Fax, Color",381.63,TEC-104
EU-TEC-CO-10003807,"HP Personal Copier, Laser",124.29,TEC-104
EU-TEC-CO-10003965,"Brother Ink, Laser",147.30,TEC-104
EU-TEC-CO-10004005,"Sharp Copy Machine, Laser",239.04,TEC-104
EU-TEC-CO-10004034,"Canon Fax Machine, High-Speed",316.59,TEC-104
EU-TEC-CO-10004042,"Brother Wireless Fax, Laser",378.81,TEC-104
EU-TEC-CO-10004045,"Hewlett Ink, High-Speed",146.88,TEC-104
EU-TEC-CO-10004078,"Sharp Fax Machine, Laser",295.65,TEC-104
EU-TEC-CO-10004089,"Canon Copy Machine, Laser",262.14,TEC-104
EU-TEC-CO-10004099,"Sharp Fax Machine, Digital",295.29,TEC-104
EU-TEC-CO-10004138,"Sharp Wireless Fax, Digital",355.56,TEC-104
EU-TEC-CO-10004147,"Brother Fax and Copier, High-Speed",189.69,TEC-104
EU-TEC-CO-10004154,"Canon Copy Machine, Digital",261.78,TEC-104
EU-TEC-CO-10004169,"HP Ink, Digital",128.34,TEC-104
EU-TEC-CO-10004252,"HP Ink, Color",130.14,TEC-104
EU-TEC-CO-10004325,"Canon Personal Copier, Laser",142.74,TEC-104
EU-TEC-CO-10004365,"HP Wireless Fax, Color",361.65,TEC-104
EU-TEC-CO-10004377,"Brother Fax Machine, High-Speed",316.74,TEC-104
EU-TEC-CO-10004558,"HP Ink, High-Speed",126.90,TEC-104
EU-TEC-CO-10004563,"HP Copy Machine, Color",245.13,TEC-104
EU-TEC-CO-10004567,"Brother Fax Machine, Color",319.98,TEC-104
EU-TEC-CO-10004662,"Hewlett Fax Machine, Color",321.36,TEC-104
EU-TEC-CO-10004664,"Hewlett Personal Copier, Color",145.71,TEC-104
EU-TEC-CO-10004976,"Brother Ink, High-Speed",145.50,TEC-104
EU-TEC-MA-10000002,"Epson Card Printer, Durable",170.07,TEC-103
EU-TEC-MA-10000003,"Konica Phone, Durable",86.31,TEC-103
EU-TEC-MA-10000110,"StarTech Phone, Wireless",74.52,TEC-103
EU-TEC-MA-10000161,"Okidata Inkjet, Wireless",314.10,TEC-103
EU-TEC-MA-10000261,"StarTech Calculator, Red",37.11,TEC-103
EU-TEC-MA-10000327,"Epson Phone, Durable",81.09,TEC-103
EU-TEC-MA-10000331,"Okidata Printer, White",266.91,TEC-103
EU-TEC-MA-10000433,"Epson Inkjet, Durable",306.63,TEC-103
EU-TEC-MA-10000461,"Epson Inkjet, Wireless",308.34,TEC-103
EU-TEC-MA-10000473,"Konica Phone, Red",83.34,TEC-103
EU-TEC-MA-10000559,"Epson Card Printer, Red",167.10,TEC-103
EU-TEC-MA-10000686,"Epson Phone, Wireless",80.97,TEC-103
EU-TEC-MA-10000687,"Konica Calculator, Red",48.78,TEC-103
EU-TEC-MA-10000753,"Epson Printer, Red",259.77,TEC-103
EU-TEC-MA-10000765,"Okidata Phone, Wireless",86.85,TEC-103
EU-TEC-MA-10000811,"Okidata Phone, Durable",86.97,TEC-103
EU-TEC-MA-10000875,"Okidata Inkjet, Wireless",314.22,TEC-103
EU-TEC-MA-10000946,"Panasonic Calculator, Red",47.43,TEC-103
EU-TEC-MA-10000982,"Konica Inkjet, Wireless",313.44,TEC-103
EU-TEC-MA-10001009,"Panasonic Inkjet, Red",309.24,TEC-103
EU-TEC-MA-10001015,"StarTech Card Printer, Durable",163.62,TEC-103
EU-TEC-MA-10001139,"Okidata Receipt Printer, Wireless",122.91,TEC-103
EU-TEC-MA-10001142,"Epson Card Printer, Wireless",169.95,TEC-103
EU-TEC-MA-10001197,"StarTech Phone, Red",71.67,TEC-103
EU-TEC-MA-10001210,"Okidata Calculator, Durable",52.41,TEC-103
EU-TEC-MA-10001279,"Panasonic Calculator, Wireless",50.28,TEC-103
EU-TEC-MA-10001298,"StarTech Receipt Printer, Wireless",110.58,TEC-103
EU-TEC-MA-10001335,"Epson Printer, Durable",262.74,TEC-103
EU-TEC-MA-10001494,"Okidata Inkjet, Durable",312.51,TEC-103
EU-TEC-MA-10001569,"Okidata Phone, Red",84.00,TEC-103
EU-TEC-MA-10001624,"Panasonic Phone, Red",81.99,TEC-103
EU-TEC-MA-10001777,"Okidata Printer, Red",265.65,TEC-103
EU-TEC-MA-10001792,"Epson Inkjet, White",305.37,TEC-103
EU-TEC-MA-10001825,"Epson Calculator, Durable",46.53,TEC-103
EU-TEC-MA-10001881,"Konica Card Printer, Red",172.32,TEC-103
EU-TEC-MA-10001934,"StarTech Printer, Red",253.32,TEC-103
EU-TEC-MA-10002043,"Epson Receipt Printer, White",115.44,TEC-103
EU-TEC-MA-10002118,"Konica Printer, Red",264.99,TEC-103
EU-TEC-MA-10002149,"Panasonic Receipt Printer, Durable",121.02,TEC-103
EU-TEC-MA-10002195,"Epson Receipt Printer, Red",114.18,TEC-103
EU-TEC-MA-10002249,"StarTech Calculator, Wireless",39.96,TEC-103
EU-TEC-MA-10002264,"Panasonic Printer, Durable",266.61,TEC-103
EU-TEC-MA-10002267,"Konica Calculator, White",50.04,TEC-103
EU-TEC-MA-10002268,"StarTech Receipt Printer, White",108.99,TEC-103
EU-TEC-MA-10002316,"Konica Printer, Durable",267.96,TEC-103
EU-TEC-MA-10002413,"Panasonic Card Printer, Durable",173.94,TEC-103
EU-TEC-MA-10002424,"StarTech Phone, Durable",74.64,TEC-103
EU-TEC-MA-10002435,"Epson Receipt Printer, Wireless",117.03,TEC-103
EU-TEC-MA-10002521,"Okidata Card Printer, Wireless",175.83,TEC-103
EU-TEC-MA-10002629,"Konica Inkjet, Wireless",313.56,TEC-103
EU-TEC-MA-10002660,"Epson Phone, White",79.38,TEC-103
EU-TEC-MA-10002686,"Okidata Card Printer, White",174.24,TEC-103
EU-TEC-MA-10002712,"Okidata Printer, Wireless",268.50,TEC-103
EU-TEC-MA-10002771,"StarTech Inkjet, White",298.92,TEC-103
EU-TEC-MA-10002779,"Panasonic Receipt Printer, Red",118.05,TEC-103
EU-TEC-MA-10002844,"Okidata Receipt Printer, White",121.32,TEC-103
EU-TEC-MA-10002864,"Okidata Calculator, White",50.70,TEC-103
EU-TEC-MA-10002918,"StarTech Card Printer, White",161.91,TEC-103
EU-TEC-MA-10002931,"Konica Receipt Printer, Red",119.40,TEC-103
EU-TEC-MA-10003078,"Epson Printer, White",261.03,TEC-103
EU-TEC-MA-10003079,"Panasonic Card Printer, Wireless",173.82,TEC-103
EU-TEC-MA-10003101,"Panasonic Receipt Printer, Wireless",120.90,TEC-103
EU-TEC-MA-10003121,"StarTech Card Printer, Wireless",163.50,TEC-103
EU-TEC-MA-10003185,"Epson Phone, Red",78.12,TEC-103
EU-TEC-MA-10003198,"Konica Phone, White",84.60,TEC-103
EU-TEC-MA-10003223,"StarTech Inkjet, Durable",300.18,TEC-103
EU-TEC-MA-10003261,"Panasonic Phone, Durable",84.96,TEC-103
EU-TEC-MA-10003280,"Panasonic Receipt Printer, White",119.31,TEC-103
EU-TEC-MA-10003298,"Konica Card Printer, Wireless",175.17,TEC-103
EU-TEC-MA-10003315,"Panasonic Card Printer, Red",170.97,TEC-103
EU-TEC-MA-10003326,"StarTech Calculator, Durable",40.08,TEC-103
EU-TEC-MA-10003404,"Konica Card Printer, Durable",175.29,TEC-103
EU-TEC-MA-10003461,"Epson Calculator, Red",43.56,TEC-103
EU-TEC-MA-10003478,"StarTech Receipt Printer, Durable",110.70,TEC-103
EU-TEC-MA-10003515,"Panasonic Printer, Red",263.64,TEC-103
EU-TEC-MA-10003557,"Panasonic Inkjet, Durable",312.21,TEC-103
EU-TEC-MA-10003558,"Panasonic Calculator, Durable",50.40,TEC-103
EU-TEC-MA-10003607,"Okidata Receipt Printer, Red",120.06,TEC-103
EU-TEC-MA-10003630,"Epson Calculator, White",44.82,TEC-103
EU-TEC-MA-10003698,"Okidata Phone, White",85.26,TEC-103
EU-TEC-MA-10003743,"StarTech Printer, Durable",256.29,TEC-103
EU-TEC-MA-10003780,"Epson Card Printer, White",168.36,TEC-103
EU-TEC-MA-10003787,"Panasonic Inkjet, Wireless",312.09,TEC-103
EU-TEC-MA-10003812,"Panasonic Printer, Wireless",266.49,TEC-103
EU-TEC-MA-10003856,"Okidata Calculator, Red",49.44,TEC-103
EU-TEC-MA-10003885,"Okidata Calculator, Wireless",52.29,TEC-103
EU-TEC-MA-10003923,"Okidata Receipt Printer, Durable",123.03,TEC-103
EU-TEC-MA-10003927,"StarTech Inkjet, Wireless",301.77,TEC-103
EU-TEC-MA-10003986,"Konica Receipt Printer, Wireless",122.25,TEC-103
EU-TEC-MA-10004143,"Konica Calculator, Wireless",51.63,TEC-103
EU-TEC-MA-10004198,"Panasonic Card Printer, White",172.23,TEC-103
EU-TEC-MA-10004224,"StarTech Inkjet, Wireless",301.89,TEC-103
EU-TEC-MA-10004323,"Panasonic Phone, White",83.25,TEC-103
EU-TEC-MA-10004408,"Konica Inkjet, Durable",311.85,TEC-103
EU-TEC-MA-10004446,"StarTech Printer, Wireless",256.17,TEC-103
EU-TEC-MA-10004452,"Epson Receipt Printer, Durable",117.15,TEC-103
EU-TEC-MA-10004482,"StarTech Card Printer, Red",160.65,TEC-103
EU-TEC-MA-10004534,"Konica Printer, Wireless",267.84,TEC-103
EU-TEC-MA-10004535,"Konica Printer, White",266.25,TEC-103
EU-TEC-MA-10004584,"Epson Calculator, Wireless",46.41,TEC-103
EU-TEC-MA-10004603,"Okidata Printer, Durable",268.62,TEC-103
EU-TEC-MA-10004609,"Okidata Inkjet, White",311.25,TEC-103
EU-TEC-MA-10004655,"Konica Receipt Printer, White",120.66,TEC-103
EU-TEC-MA-10004669,"Epson Inkjet, Wireless",308.22,TEC-103
EU-TEC-MA-10004693,"Panasonic Calculator, White",48.69,TEC-103
EU-TEC-MA-10004772,"Konica Inkjet, White",310.59,TEC-103
EU-TEC-MA-10004814,"Panasonic Inkjet, White",310.50,TEC-103
EU-TEC-MA-10004896,"StarTech Phone, White",72.93,TEC-103
EU-TEC-MA-10004897,"StarTech Calculator, White",38.37,TEC-103
EU-TEC-MA-10004929,"Panasonic Printer, White",264.90,TEC-103
EU-TEC-MA-10004933,"Konica Phone, Wireless",86.19,TEC-103
EU-TEC-MA-10004955,"Okidata Card Printer, Durable",175.95,TEC-103
EU-TEC-PH-10000026,"Nokia Office Telephone, Cordless",67.98,TEC-101
EU-TEC-PH-10000037,"Cisco Signal Booster, Cordless",154.68,TEC-101
EU-TEC-PH-10000038,"Nokia Speaker Phone, with Caller ID",123.15,TEC-101
EU-TEC-PH-10000070,"Nokia Headset, with Caller ID",73.11,TEC-101
EU-TEC-PH-10000158,"Apple Signal Booster, VoIP",136.74,TEC-101
EU-TEC-PH-10000160,"Motorola Smart Phone, with Caller ID",645.54,TEC-101
EU-TEC-PH-10000258,"Motorola Audio Dock, Cordless",176.22,TEC-101
EU-TEC-PH-10000270,"Apple Office Telephone, VoIP",65.37,TEC-101
EU-TEC-PH-10000292,"Samsung Office Telephone, Full Size",66.51,TEC-101
EU-TEC-PH-10000309,"Motorola Audio Dock, with Caller ID",173.37,TEC-101
EU-TEC-PH-10000437,"Cisco Signal Booster, VoIP",151.92,TEC-101
EU-TEC-PH-10000458,"Nokia Office Telephone, Full Size",66.42,TEC-101
EU-TEC-PH-10000490,"Motorola Audio Dock, Full Size",174.66,TEC-101
EU-TEC-PH-10000493,"Apple Smart Phone, Full Size",637.50,TEC-101
EU-TEC-PH-10000494,"Apple Speaker Phone, Cordless",126.15,TEC-101
EU-TEC-PH-10000505,"Apple Smart Phone, with Caller ID",639.06,TEC-101
EU-TEC-PH-10000641,"Motorola Headset, Full Size",81.03,TEC-101
EU-TEC-PH-10000647,"Samsung Office Telephone, VoIP",65.31,TEC-101
EU-TEC-PH-10000705,"Apple Headset, Cordless",76.11,TEC-101
EU-TEC-PH-10000800,"Cisco Smart Phone, Full Size",652.68,TEC-101
EU-TEC-PH-10000810,"Nokia Headset, VoIP",73.20,TEC-101
EU-TEC-PH-10000879,"Cisco Smart Phone, Full Size",651.39,TEC-101
EU-TEC-PH-10000956,"Motorola Speaker Phone, with Caller ID",129.78,TEC-101
EU-TEC-PH-10001014,"Cisco Speaker Phone, with Caller ID",138.48,TEC-101
EU-TEC-PH-10001066,"Apple Smart Phone, Cordless",636.30,TEC-101
EU-TEC-PH-10001070,"Samsung Headset, VoIP",73.29,TEC-101
EU-TEC-PH-10001117,"Apple Smart Phone, Full Size",636.21,TEC-101
EU-TEC-PH-10001148,"Samsung Signal Booster, VoIP",136.68,TEC-101
EU-TEC-PH-10001163,"Motorola Speaker Phone, Cordless",132.63,TEC-101
EU-TEC-PH-10001382,"Apple Office Telephone, Cordless",68.13,TEC-101
EU-TEC-PH-10001396,"Nokia Smart Phone, Cordless",636.15,TEC-101
EU-TEC-PH-10001432,"Motorola Signal Booster, Cordless",145.98,TEC-101
EU-TEC-PH-10001470,"Cisco Office Telephone, with Caller ID",80.46,TEC-101
EU-TEC-PH-10001557,"Apple Speaker Phone, VoIP",123.39,TEC-101
EU-TEC-PH-10001573,"Nokia Smart Phone, with Caller ID",638.91,TEC-101
EU-TEC-PH-10001574,"Nokia Audio Dock, Cordless",169.59,TEC-101
EU-TEC-PH-10001664,"Motorola Office Telephone, VoIP",71.85,TEC-101
EU-TEC-PH-10001708,"Cisco Audio Dock, with Caller ID",182.07,TEC-101
EU-TEC-PH-10001732,"Samsung Audio Dock, Cordless",169.68,TEC-101
EU-TEC-PH-10001937,"Nokia Audio Dock, Full Size",168.03,TEC-101
EU-TEC-PH-10001963,"Nokia Speaker Phone, Full Size",124.44,TEC-101
EU-TEC-PH-10002018,"Samsung Audio Dock, VoIP",166.92,TEC-101
EU-TEC-PH-10002035,"Samsung Smart Phone, Cordless",639.00,TEC-101
EU-TEC-PH-10002076,"Samsung Audio Dock, Full Size",168.12,TEC-101
EU-TEC-PH-10002079,"Motorola Headset, with Caller ID",79.74,TEC-101
EU-TEC-PH-10002119,"Samsung Headset, Full Size",74.49,TEC-101
EU-TEC-PH-10002222,"Cisco Office Telephone, VoIP",80.55,TEC-101
EU-TEC-PH-10002255,"Apple Audio Dock, Full Size",168.18,TEC-101
EU-TEC-PH-10002296,"Nokia Headset, Full Size",74.40,TEC-101
EU-TEC-PH-10002312,"Samsung Audio Dock, with Caller ID",166.83,TEC-101
EU-TEC-PH-10002419,"Motorola Headset, Cordless",82.59,TEC-101
EU-TEC-PH-10002456,"Cisco Speaker Phone, Cordless",141.33,TEC-101
EU-TEC-PH-10002491,"Samsung Office Telephone, Cordless",68.07,TEC-101
EU-TEC-PH-10002564,"Motorola Signal Booster, Full Size",144.42,TEC-101
EU-TEC-PH-10002565,"Apple Audio Dock, with Caller ID",166.89,TEC-101
EU-TEC-PH-10002586,"Nokia Office Telephone, with Caller ID",65.13,TEC-101
EU-TEC-PH-10002597,"Apple Signal Booster, with Caller ID",136.65,TEC-101
EU-TEC-PH-10002623,"Cisco Smart Phone, with Caller ID",654.24,TEC-101
EU-TEC-PH-10002645,"Motorola Signal Booster, with Caller ID",143.13,TEC-101
EU-TEC-PH-10002663,"Nokia Signal Booster, VoIP",136.59,TEC-101
EU-TEC-PH-10002715,"Cisco Audio Dock, VoIP",182.16,TEC-101
EU-TEC-PH-10002759,"Cisco Smart Phone, Cordless",651.48,TEC-101
EU-TEC-PH-10002898,"Samsung Smart Phone, Full Size",637.44,TEC-101
EU-TEC-PH-10002907,"Motorola Headset, VoIP",79.83,TEC-101
EU-TEC-PH-10002932,"Samsung Speaker Phone, VoIP",123.33,TEC-101
EU-TEC-PH-10002935,"Samsung Smart Phone, VoIP",636.24,TEC-101
EU-TEC-PH-10003055,"Apple Audio Dock, Cordless",169.74,TEC-101
EU-TEC-PH-10003137,"Nokia Signal Booster, Cordless",139.35,TEC-101
EU-TEC-PH-10003153,"Samsung Signal Booster, with Caller ID",136.59,TEC-101
EU-TEC-PH-10003325,"Samsung Speaker Phone, with Caller ID",123.24,TEC-101
EU-TEC-PH-10003353,"Motorola Office Telephone, Cordless",74.61,TEC-101
EU-TEC-PH-10003439,"Apple Audio Dock, VoIP",166.98,TEC-101
EU-TEC-PH-10003492,"Cisco Audio Dock, Full Size",183.36,TEC-101
EU-TEC-PH-10003513,"Nokia Speaker Phone, VoIP",123.24,TEC-101
EU-TEC-PH-10003549,"Samsung Headset, with Caller ID",73.20,TEC-101
EU-TEC-PH-10003601,"Apple Office Telephone, with Caller ID",65.28,TEC-101
EU-TEC-PH-10003620,"Apple Signal Booster, Cordless",139.50,TEC-101
EU-TEC-PH-10003683,"Motorola Audio Dock, VoIP",173.46,TEC-101
EU-TEC-PH-10003698,"Nokia Signal Booster, Full Size",137.79,TEC-101
EU-TEC-PH-10003713,"Cisco Audio Dock, Cordless",184.92,TEC-101
EU-TEC-PH-10003762,"Motorola Smart Phone, Full Size",642.69,TEC-101
EU-TEC-PH-10003770,"Apple Speaker Phone, Full Size",124.59,TEC-101
EU-TEC-PH-10003774,"Cisco Headset, with Caller ID",88.44,TEC-101
EU-TEC-PH-10003847,"Apple Headset, with Caller ID",73.26,TEC-101
EU-TEC-PH-10003916,"Motorola Office Telephone, with Caller ID",71.76,TEC-101
EU-TEC-PH-10003927,"Cisco Signal Booster, Full Size",153.12,TEC-101
EU-TEC-PH-10003960,"Apple Speaker Phone, with Caller ID",123.30,TEC-101
EU-TEC-PH-10003963,"Apple Signal Booster, Full Size",137.94,TEC-101
EU-TEC-PH-10003995,"Nokia Audio Dock, VoIP",166.83,TEC-101
EU-TEC-PH-10004028,"Apple Headset, Full Size",74.55,TEC-101
EU-TEC-PH-10004105,"Motorola Speaker Phone, VoIP",129.87,TEC-101
EU-TEC-PH-10004152,"Apple Headset, VoIP",73.35,TEC-101
EU-TEC-PH-10004162,"Samsung Speaker Phone, Cordless",126.09,TEC-101
EU-TEC-PH-10004223,"Cisco Speaker Phone, Full Size",139.77,TEC-101
EU-TEC-PH-10004241,"Cisco Headset, Cordless",91.29,TEC-101
EU-TEC-PH-10004263,"Cisco Signal Booster, with Caller ID",151.83,TEC-101
EU-TEC-PH-10004271,"Cisco Speaker Phone, VoIP",138.57,TEC-101
EU-TEC-PH-10004297,"Motorola Speaker Phone, Full Size",131.07,TEC-101
EU-TEC-PH-10004327,"Motorola Smart Phone, Full Size",643.98,TEC-101
EU-TEC-PH-10004450,"Cisco Office Telephone, Full Size",81.75,TEC-101
EU-TEC-PH-10004505,"Nokia Smart Phone, Full Size",637.35,TEC-101
EU-TEC-PH-10004552,"Motorola Office Telephone, Full Size",73.05,TEC-101
EU-TEC-PH-10004583,"Motorola Smart Phone, Cordless",642.78,TEC-101
EU-TEC-PH-10004601,"Nokia Audio Dock, with Caller ID",166.74,TEC-101
EU-TEC-PH-10004614,"Cisco Headset, Full Size",89.73,TEC-101
EU-TEC-PH-10004635,"Samsung Office Telephone, with Caller ID",65.22,TEC-101
EU-TEC-PH-10004707,"Samsung Signal Booster, Cordless",139.44,TEC-101
EU-TEC-PH-10004732,"Cisco Office Telephone, Cordless",83.31,TEC-101
EU-TEC-PH-10004772,"Motorola Signal Booster, VoIP",143.22,TEC-101
EU-TEC-PH-10004810,"Samsung Speaker Phone, Full Size",124.53,TEC-101
EU-TEC-PH-10004823,"Nokia Smart Phone, Full Size",636.06,TEC-101
EU-TEC-PH-10004825,"Cisco Headset, VoIP",88.53,TEC-101
EU-TEC-PH-10004827,"Samsung Headset, Cordless",76.05,TEC-101
EU-TEC-PH-10004879,"Nokia Headset, Cordless",75.96,TEC-101
EU-TEC-PH-10004882,"Nokia Office Telephone, VoIP",65.22,TEC-101
EU-TEC-PH-10004910,"Samsung Signal Booster, Full Size",137.88,TEC-101
EU-TEC-PH-10004915,"Nokia Speaker Phone, Cordless",126.00,TEC-101
EU-TEC-PH-10004992,"Apple Office Telephone, Full Size",66.57,TEC-101
US-FUR-BO-10000112,"Bush Birmingham Collection Bookcase, Dark Cherry",130.98,FUR-101
US-FUR-BO-10000330,"Sauder Camden County Barrister Bookcase, Planked Cherry Finish",120.98,FUR-101
US-FUR-BO-10000362,Sauder Inglewood Library Bookcases,170.98,FUR-101
US-FUR-BO-10000468,O'Sullivan 2-Shelf Heavy-Duty Bookcases,48.58,FUR-101
US-FUR-BO-10000711,"Hon Metal Bookcases, Gray",70.98,FUR-101
US-FUR-BO-10000780,O'Sullivan Plantations 2-Door Library in Landvery Oak,200.98,FUR-101
US-FUR-BO-10001337,O'Sullivan Living Dimensions 2-Shelf Bookcases,120.98,FUR-101
US-FUR-BO-10001519,O'Sullivan 3-Shelf Heavy-Duty Bookcases,58.14,FUR-101
US-FUR-BO-10001567,"Bush Westfield Collection Bookcases, Dark Cherry Finish, Fully Assembled",100.98,FUR-101
US-FUR-BO-10001601,"Sauder Mission Library with Doors, Fruitwood Finish",130.98,FUR-101
US-FUR-BO-10001608,"Hon Metal Bookcases, Black",70.98,FUR-101
US-FUR-BO-10001619,O'Sullivan Cherrywood Estates Traditional Bookcase,84.98,FUR-101
US-FUR-BO-10001798,Bush Somerset Collection Bookcase,130.98,FUR-101
US-FUR-BO-10001811,"Atlantic Metals Mobile 5-Shelf Bookcases, Custom Colors",300.98,FUR-101
US-FUR-BO-10001918,"Sauder Forest Hills Library with Doors, Woodland Oak Finish",160.98,FUR-101
US-FUR-BO-10001972,O'Sullivan 4-Shelf Bookcase in Odessa Pine,120.98,FUR-101
US-FUR-BO-10002202,"Atlantic Metals Mobile 2-Shelf Bookcases, Custom Colors",240.98,FUR-101
US-FUR-BO-10002206,"Bush Saratoga Collection 5-Shelf Bookcase, Hanover Cherry, *Special Order",140.98,FUR-101
US-FUR-BO-10002213,DMI Eclipse Executive Suite Bookcases,500.98,FUR-101
US-FUR-BO-10002268,Sauder Barrister Bookcases,80.98,FUR-101
US-FUR-BO-10002545,"Atlantic Metals Mobile 3-Shelf Bookcases, Custom Colors",260.98,FUR-101
US-FUR-BO-10002598,"Hon Metal Bookcases, Putty",70.98,FUR-101
US-FUR-BO-10002613,"Atlantic Metals Mobile 4-Shelf Bookcases, Custom Colors",280.98,FUR-101
US-FUR-BO-10002824,Bush Mission Pointe Library,150.98,FUR-101
US-FUR-BO-10002853,O'Sullivan 5-Shelf Heavy-Duty Bookcases,81.94,FUR-101
US-FUR-BO-10002916,"Rush Hierlooms Collection 1"" Thick Stackable Bookcases",170.98,FUR-101
US-FUR-BO-10003034,"O'Sullivan Elevations Bookcase, Cherry Finish",130.98,FUR-101
US-FUR-BO-10003159,"Sauder Camden County Collection Libraries, Planked Cherry Finish",114.98,FUR-101
US-FUR-BO-10003272,O'Sullivan Living Dimensions 5-Shelf Bookcases,220.98,FUR-101
US-FUR-BO-10003404,"Global Adaptabilites Bookcase, Cherry/Storm Gray Finish",430.98,FUR-101
US-FUR-BO-10003433,Sauder Cornerstone Collection Library,30.98,FUR-101
US-FUR-BO-10003441,"Bush Westfield Collection Bookcases, Fully Assembled",100.98,FUR-101
US-FUR-BO-10003450,"Bush Westfield Collection Bookcases, Dark Cherry Finish",57.98,FUR-101
US-FUR-BO-10003546,Hon 4-Shelf Metal Bookcases,100.98,FUR-101
US-FUR-BO-10003660,"Bush Cubix Collection Bookcases, Fully Assembled",220.98,FUR-101
US-FUR-BO-10003893,Sauder Camden County Collection Library,114.98,FUR-101
US-FUR-BO-10003894,"Safco Value Mate Steel Bookcase, Baked Enamel Finish on Steel, Black",70.98,FUR-101
US-FUR-BO-10003965,O'Sullivan Manor Hill 2-Door Library in Brianna Oak,180.98,FUR-101
US-FUR-BO-10003966,"Sauder Facets Collection Library, Sky Alder Finish",170.98,FUR-101
US-FUR-BO-10004015,"Bush Andora Bookcase, Maple/Graphite Gray Finish",119.99,FUR-101
US-FUR-BO-10004218,"Bush Heritage Pine Collection 5-Shelf Bookcase, Albany Pine Finish, *Special Order",140.98,FUR-101
